Title,Price,Description,Link,Date,Usage,Brand,Model,ClassifiedDate
HP - lj managed e60155dn (3gy09a),"€ 595,00",Lj managed e60155dn (3gy09a) een printer kopen bij secondhandhp is voor een dynamisch en modern bedrijf de slimste keuze. Ga je da,https://www.marktplaats.nl/v/computers-en-software/printers/a1497304302-hp-lj-managed-e60155dn-3gy09a,Gisteren,Zo goed als nieuw,HP,lj managed e60155dn (3gy09a),Gisteren
HP - CLJ Enterprise MFP M680dn (CZ248A),"€ 895,00","Clj enterprise mfp m680dn (cz248a) hp color laserjet enterprise mfp m680dn, laserjet. Printtechnologie: laser, printen: colour pri",https://www.marktplaats.nl/v/computers-en-software/printers/a1497304164-hp-clj-enterprise-mfp-m680dn-cz248a,15 jan 25,Zo goed als nieuw,HP,CLJ Enterprise MFP M680dn (CZ248A),15 Jan 2025
BASIC Game PC HP i5 NVIDIA GT1030 2GB - Windows 11,"€ 329,00",Refurbished game pc van alpha-shop: de refurbished basic game pc is door ons samengesteld om jou te voorzien van een zeer voordeli,https://www.marktplaats.nl/v/computers-en-software/desktop-pc-s/a1507378440-basic-game-pc-hp-i5-nvidia-gt1030-2gb-windows-11,18 jan 25,Nieuw,HP,i5 NVIDIA GT1030,18 jan 25
HP - clj managed mfp e87640du-e87660du – basis (5cm63a),"€ 2.595,00",Clj managed mfp e87640du-e87660du – basis (5cm63a) ontdek de hp clj managed mfp e87640du-e87660du – basis (5cm63a) bij second hand,https://www.marktplaats.nl/v/computers-en-software/printers/a1504389600-hp-clj-managed-mfp-e87640du-e87660du-basis-5cm63a,Vandaag,Nieuw,HP,clj managed mfp e87640du-e87660du – basis (5cm63a),Vandaag
HP - lj managed flow e82540z mfp (z8z19a),"€ 1.695,00","Lj managed flow e82540z mfp (z8z19a) bent u op zoek naar een krachtige, multifunctionele printer voor uw kantoor, maar wilt u niet",https://www.marktplaats.nl/v/computers-en-software/printers/a1497304352-hp-lj-managed-flow-e82540z-mfp-z8z19a,17 jan 25,Zo goed als nieuw,HP,lj managed flow e82540z mfp (z8z19a),17 jan 25
Dell Optiplex 3070 MFF i3-9100T 8GB 128GB NVMe Windows11,"€ 139,00",Welkom bij pc magnaat! Graag bieden wij u het volgende aan: merk : dell model serie: optiplex model type: 3070 formaat: klein (tin,https://www.marktplaats.nl/v/computers-en-software/desktop-pc-s/a1509614816-dell-optiplex-3070-mff-i3-9100t-8gb-128gb-nvme-windows11,18 jan 25,Zo goed als nieuw,Dell,Optiplex 3070,18 jan 25
HP - LJ Enterprise Flow MFP M630z (B3G86A),"€ 995,00","Lj enterprise flow mfp m630z (b3g86a) single-pass, dubbelzijdig scannen ingebouwde fax sorteer en niet finisher u kunt een reeks p",https://www.marktplaats.nl/v/computers-en-software/printers/a1497304407-hp-lj-enterprise-flow-mfp-m630z-b3g86a,17 jan 25,Zo goed als nieuw,HP,LJ Enterprise Flow MFP M630z (B3G86A),17 jan 25
Desktop HP 260 mini met monitor en printer,"€ 90,00",Te koop: complete desktop van hp. Wat zit er allemaal bij: hp 260 g2 mini benq monitor 24 inch hp 2600 printer toetsenbord muis al,https://www.marktplaats.nl/v/computers-en-software/desktop-pc-s/m2225075003-desktop-hp-260-mini-met-monitor-en-printer,Eergisteren,Zo goed als nieuw,HP,260 G2 mini,Eergisteren
HP - CLJ Enterprise Flow MFP M680z (CZ250A),"€ 995,00","Clj enterprise flow mfp m680z (cz250a) - zeer uitgebreide kleuren multifuntional. - Printen, kopieren, scannen tot a4 formaat - sc",https://www.marktplaats.nl/v/computers-en-software/printers/a1497304400-hp-clj-enterprise-flow-mfp-m680z-cz250a,Eergisteren,Zo goed als nieuw,HP,CLJ Enterprise Flow MFP M680z (CZ250A),Eergisteren
HP - LJ Enterprise FLOW 500 MFP M525C (CF118A),"€ 595,00","Lj enterprise flow 500 mfp m525c (cf118a) - zeer uitgebreide zwart-wit multifuntional. - Printen, kopieren, scannen tot a4) formaa",https://www.marktplaats.nl/v/computers-en-software/printers/a1497662813-hp-lj-enterprise-flow-500-mfp-m525c-cf118a,15 jan 25,Zo goed als nieuw,HP,LJ Enterprise FLOW 500 MFP M525C (CF118A),15 jan 25
HP - lj managed flow mfp e82560z (x3a74a),"€ 1.995,00","Lj managed flow mfp e82560z (x3a74a) bent u op zoek naar een hoogwaardige multifunctionele printer voor uw bedrijf, maar wilt u ni",https://www.marktplaats.nl/v/computers-en-software/printers/a1497304332-hp-lj-managed-flow-mfp-e82560z-x3a74a,Gisteren,Nieuw,HP,lj managed flow mfp e82560z (x3a74a),Gisteren
HP vs17 Monitor Computer Scherm 17 inch,"€ 5,00","Hp vs17 monitor computer scherm 17 inch. Dit scherm is nog in goede staat en werkt nog goed.  Schermdiagonaal: 17"" beeldverho",https://www.marktplaats.nl/v/computers-en-software/monitoren/m2225870679-hp-vs17-monitor-computer-scherm-17-inch,Vandaag,Zo goed als nieuw,HP,vs17,Vandaag
HP Probook 650 G5 Intel Core i5 8265U | 8GB | 256GB SSD |...,"€ 269,00","Nu in de aanbieding van € 299,00 voor € 269,00! L&o computers maakt de verkoop van gebruikte ex-lease producten moge",https://www.marktplaats.nl/v/computers-en-software/windows-laptops/a1508549187-hp-probook-650-g5-intel-core-i5-8265u-8gb-256gb-ssd,Gisteren,Zo goed als nieuw,HP,Probook 650 G5,Gisteren
Lenovo Tiny M720q i5 8GB DDR4 256GB NVMe Windows 11/10,"€ 279,00",Welkom bij pc magnaat! Graag bieden wij u het volgende aan: merk : lenovo model: thinkcentre m720q formaat: klein (tiny) processor,https://www.marktplaats.nl/v/computers-en-software/desktop-pc-s/a1509614869-lenovo-tiny-m720q-i5-8gb-ddr4-256gb-nvme-windows-11-10,Gisteren,Zo goed als nieuw,Lenovo,ThinkCentre M720q,Gisteren
HP t520 ThinClient / AMD GX-212JC/ 32GB SSD/ 4GB DDR3/ Wi...,"€ 64,99",Specificaties: processor: amd gx-212jc 1.2Ghz geheugen: 4gb ddr3l opslag: 32gb ssd videokaart: amd radeon hd graphics optische-dri,https://www.marktplaats.nl/v/computers-en-software/desktop-pc-s/a1481767023-hp-t520-thinclient-amd-gx-212jc-32gb-ssd-4gb-ddr3-wi,Gisteren,Zo goed als nieuw,HP,t520 ThinClient,Gisteren
HP USB-C Dock G4 | incl. 90 watt adapter,"€ 49,00","Hp usb-c dock g4 wordt geleverd met; usb-c kabel, netsnoer & power adapter (90-watt) de hp usb-c dock is een compact en kracht",https://www.marktplaats.nl/v/computers-en-software/dockingstations/a1493589739-hp-usb-c-dock-g4-incl-90-watt-adapter,Gisteren,Gebruikt,HP,USB-C Dock G4,Gisteren
HP Chromebook 11 G7 EE - Updates 2029 - 3 maanden Garantie,"€ 85,00","Op zoek naar een betrouwbare, compacte laptop voor werk of studie? De hp chromebook 11 g7 biedt precies wat je nodig hebt in een l",https://www.marktplaats.nl/v/computers-en-software/chromebooks/a1507719716-hp-chromebook-11-g7-ee-updates-2029-3-maanden-garantie,Gisteren,Refurbished,HP,Chromebook 11 G7 EE,Gisteren
HP - CLJ Enterprise Flow MFP M680z (CZ250A),"€ 995,00","Clj enterprise flow mfp m680z (cz250a) - zeer uitgebreide kleuren multifuntional. - Printen, kopieren, scannen tot a4 formaat - sc",https://www.marktplaats.nl/v/computers-en-software/printers/a1497304400-hp-clj-enterprise-flow-mfp-m680z-cz250a,Gisteren,Zo goed als nieuw,HP,CLJ Enterprise Flow MFP M680z (CZ250A),Gisteren
HP print toner laserjet - HP 51A / Q7551XC,"€ 9,95",Hp print toner laserjet hp print toner laserjet (hoge cap. = 6500 Pagina's) hoge kwaliteit orginele hp toner: niet gebruikt in,https://www.marktplaats.nl/v/computers-en-software/printerbenodigdheden/m2225751699-hp-print-toner-laserjet-hp-51a-q7551xc,Gisteren,Nieuw,HP,51A / Q7551XC,Gisteren
All In One A4 Kleurenprinter Refurbished Garantie HP CM4540,"€ 599,00","Reburbished zeer professionele a4 all in one kleuren laserprinter (hp color laserjet cm4540fskm) vanaf € 599,- (tot € 89",https://www.marktplaats.nl/v/computers-en-software/printers/a1112160640-all-in-one-a4-kleurenprinter-refurbished-garantie-hp-cm4540,Gisteren,Zo goed als nieuw,HP,CM4540,Gisteren
HP - Designjet T2600 Dual roll 36 inch postscript mfp,"€ 5.995,00",Designjet t2600 dual roll 36 inch postscript mfp (3ek15a) hp designjet t2600 mfp dr ps 36 inch – (3ek15a) ontwikkeld met het oog o,https://www.marktplaats.nl/v/computers-en-software/printers/a1508764597-hp-designjet-t2600-dual-roll-36-inch-postscript-mfp,18 jan 25,Zo goed als nieuw,HP,Designjet T2600,18 jan 25
HP - lj managed mfp e82540dn (x3a69a),"€ 1.595,00",Lj managed mfp e82540dn (x3a69a) a3 multifunction automatic duplex 1200x1200 dpi resolution 7000 mb ram 40ppm mono 2 x 520 sheet p,https://www.marktplaats.nl/v/computers-en-software/printers/a1509108250-hp-lj-managed-mfp-e82540dn-x3a69a,18 jan 25,Nieuw,HP,lj managed mfp e82540dn (x3a69a),18 jan 25
"HP - LJ Managed Flow MFP E78630z (5QJ94A,8EP56AAE)","€ 2.795,00",Clj managed flow mfp e786z (5qj94a) ontdek de hp clj managed flow mfp e786z (5qj94a) - de ultieme a3 multifunctionele printer! Wil,https://www.marktplaats.nl/v/computers-en-software/printers/a1507241988-hp-lj-managed-flow-mfp-e78630z-5qj94a-8ep56aae,18 jan 25,Nieuw,HP,LJ Managed Flow MFP E78630z,18 jan 25
Printercartridge HP 932 XL/933 XL 4-kleuren Multipack,Bieden,"Originele set hp cartridges (nieuw) te koop. Geschikt voor oa hp officejet 6100/6600/7510/7610. Wegens defecte printer, cartridges",https://www.marktplaats.nl/v/computers-en-software/printerbenodigdheden/m2225088888-printercartridge-hp-932-xl-933-xl-4-kleuren-multipack,Eergisteren,Nieuw,HP,932 XL/933 XL,Eergisteren
HP - LJ Managed Flow MFP E72525-E72535z -(X3A70A),"€ 1.295,00",Lj managed flow mfp e72525-e72535z -(x3a70a) tcop bv(second hand hp) weerschip 10 3991 cr houten tel.: 030-2288022 Fax.: 030-22508,https://www.marktplaats.nl/v/computers-en-software/printers/a1504389602-hp-lj-managed-flow-mfp-e72525-e72535z-x3a70a,Eergisteren,Zo goed als nieuw,HP,LJ Managed Flow MFP E72525-E72535z (X3A70A),Eergisteren
"Printer cartridges HP 301 XL, kleur en zwart",Bieden,"Printercartridges 301xl voor hp van 123inkt, vervangt hp ch563ee en hp ch564ee. Nieuwe, ongeopende cartridges van 123inkt, niet me",https://www.marktplaats.nl/v/computers-en-software/printerbenodigdheden/m2224716533-printer-cartridges-hp-301-xl-kleur-en-zwart,18 jan 25,Nieuw,HP,301 XL,18 jan 25
HP - clj flow mfp m880z mfp (a2w75a),"€ 3.995,00","Clj flow mfp m880z mfp (a2w75a) - eenvoudig te bedienen touchscreen - zeer uitgebreide kleurenmogelijkheden - printen, kopiëren, s",https://www.marktplaats.nl/v/computers-en-software/printers/a1509569115-hp-clj-flow-mfp-m880z-mfp-a2w75a,18 jan 25,Nieuw,HP,clj flow mfp m880z mfp (a2w75a),18 jan 25
HP - clj enterprise flow mfp m681z (j8a13a),"€ 3.995,00",Clj enterprise flow mfp m681z (j8a13a) bent u op zoek naar een professionele en hoogwaardige multifunctionele kleurenprinter voor,https://www.marktplaats.nl/v/computers-en-software/printers/a1497304311-hp-clj-enterprise-flow-mfp-m681z-j8a13a,Eergisteren,Nieuw,HP,clj enterprise flow mfp m681z (j8a13a),Eergisteren
HP Q2672A gele tonercartridge,Bieden,Originele hp q2672a gele tonercartridge capaciteit ca. 4.000 Pagina's geschikt voor: hp color laserjet 3500 hp color laserjet,https://www.marktplaats.nl/v/computers-en-software/printerbenodigdheden/m2223497404-hp-q2672a-gele-tonercartridge,15 jan 25,Nieuw,HP,Q2672A,15 jan 25
HP - HP booklet finisher M855/M880 (A2W83A),"€ 695,00",Hp booklet finisher m855/m880 (a2w83a) tcop bv(second hand hp) weerschip 10 3991 cr houten tel.: 030-2288022 Fax.: 030-2250842 Bez,https://www.marktplaats.nl/v/computers-en-software/printerbenodigdheden/a1497304405-hp-hp-booklet-finisher-m855-m880-a2w83a,15 jan 25,Zo goed als nieuw,HP,HP booklet finisher M855/M880 (A2W83A),15 jan 25
HP Q2670A zwart tonercartridge,Bieden,Originele hp q2670a zwarte tonercartridge capaciteit ca. 6.000 Pagina's geschikt voor: hp color laserjet 3500 hp color laserje,https://www.marktplaats.nl/v/computers-en-software/printerbenodigdheden/m2223165986-hp-q2670a-zwart-tonercartridge,14 jan 25,Nieuw,HP,Q2670A,14 jan 25
HP - Duplex HP LJ 4250 / 4350 (Q2439B),"€ 50,00",Duplex hp lj 4250 / 4350 (q2439b) - refurbished printer onderdeel- losse duplex unit voor de hp lj 4250 serie tcop bv(second hand,https://www.marktplaats.nl/v/computers-en-software/printerbenodigdheden/a1497304394-hp-duplex-hp-lj-4250-4350-q2439b,14 jan 25,Zo goed als nieuw,HP,LJ 4250 / 4350 (Q2439B),14 jan 25
Zelf samenstellen HP Proliant DL380 Gen 9 server,"€ 400,40",Creoserver.com is een ervaren specialist in maatwerk van hardware. We bieden hp servers gegarandeerd in top refurbished conditie.,https://www.marktplaats.nl/v/computers-en-software/servers/a1126314344-zelf-samenstellen-hp-proliant-dl380-gen-9-server,17 jan 25,Refurbished,HP,Proliant DL380 Gen 9,17 jan 25
Nieuwe HP Canon Brother Toners in doos,Zie omschrijving,"Diversen nieuwe toners cartridges voor in hp , brother , canon ed. Prijs op aanvraag diverse types, bijv : hp 3000 hp 3200 hp 3600",https://www.marktplaats.nl/v/computers-en-software/printerbenodigdheden/m2225096697-nieuwe-hp-canon-brother-toners-in-doos,Eergisteren,Nieuw,HP,Unknown,Eergisteren
HP - CLJ Enterprise 700 Color MFP M775f (CC523A),"€ 995,00","Clj enterprise 700 color mfp m775f (cc523a) - zeer uitgebreide kleuren multifuntional. - Printen, kopieren, scannen tot a3 formaat",https://www.marktplaats.nl/v/computers-en-software/printers/a1497304418-hp-clj-enterprise-700-color-mfp-m775f-cc523a,Eergisteren,Zo goed als nieuw,HP,CLJ Enterprise 700 Color MFP M775f (CC523A),Eergisteren
Te Koop : HP 410X (HP CF410X en HP CF413X) toners,Bieden,Te koop : hp 410x (hp cf410x en hp cf413x) toners deze toners zitten nog in dichte onbeschadigde verpakking geschikte printers : h,https://www.marktplaats.nl/v/computers-en-software/printerbenodigdheden/m2225549459-te-koop-hp-410x-hp-cf410x-en-hp-cf413x-toners,Gisteren,Nieuw,HP,410X,Gisteren
HP - clj flow mfp m880z+ mfp (a2w76a),"€ 995,00","- nieuwprijs hp eur 6999,- - eenvoudige te bedienen touchscreen - zeer uitgebreide kleuren multifuntional. - Printen, kopieren, sc",https://www.marktplaats.nl/v/computers-en-software/printers/a1497304265-hp-clj-flow-mfp-m880z-mfp-a2w76a,Gisteren,Zo goed als nieuw,HP,clj flow mfp m880z+ mfp (a2w76a),Gisteren
Te Koop : HP 301 cartridges (Zwart en kleur),Bieden,Te koop : hp 301 cartridges (zwart en kleur) geschikte printers : hp deskjet 1000 hp deskjet 1010 hp deskjet 1050 hp deskjet 1050a,https://www.marktplaats.nl/v/computers-en-software/printerbenodigdheden/m2225551361-te-koop-hp-301-cartridges-zwart-en-kleur,Gisteren,Nieuw,HP,301,Gisteren
HP - (j6054b),"€ 125,00",(j6054b) tcop bv(second hand hp) weerschip 10 3991 cr houten tel.: 030-2288022 Fax.: 030-2250842 Bezichtiging en afhaal op afspraa,https://www.marktplaats.nl/v/computers-en-software/printerbenodigdheden/a1497304191-hp-j6054b,Gisteren,Zo goed als nieuw,HP,j6054b,Gisteren
"HP - CLJ Managed Flow MFP E78635z (5QJ94A,8EP57AAE)","€ 2.695,00",Clj managed flow mfp e786z (5qj94a) ontdek de hp clj managed flow mfp e786z (5qj94a) - de ultieme a3 multifunctionele printer! Wil,https://www.marktplaats.nl/v/computers-en-software/printers/a1507241987-hp-clj-managed-flow-mfp-e78635z-5qj94a-8ep57aae,18 jan 25,Nieuw,HP,CLJ Managed Flow MFP E78635z,18 jan 25
Te Koop : HP CF226X (26X) tonercartridge (N.V.),Bieden,Te koop : hp cf226x (26x) tonercartridge (n.v.) Geschikte printers : hp laserjet pro m402dn hp laserjet pro m402dne hp laserjet pr,https://www.marktplaats.nl/v/computers-en-software/printerbenodigdheden/m2224740363-te-koop-hp-cf226x-26x-tonercartridge-n-v,18 jan 25,Nieuw,HP,CF226X (26X),18 jan 25
HP Probook 650 G4 Intel Core i5 8250U | 8GB | 256GB SSD |...,"€ 249,00","L&o computers maakt de verkoop van gebruikte ex-lease producten mogelijk door deze in de productieafdeling te controleren, tes",https://www.marktplaats.nl/v/computers-en-software/windows-laptops/a1509895582-hp-probook-650-g4-intel-core-i5-8250u-8gb-256gb-ssd,Vandaag,Zo goed als nieuw,HP,Probook 650 G4,Vandaag
Lenovo ThinkCentre M70q i5 8GB DDR4 256GB NVMe Windows 11/10,"€ 379,00",Welkom bij pc magnaat! Graag bieden wij u het volgende aan: merk : lenovo model serie: thinkcentre model type: m70q formaat: klein,https://www.marktplaats.nl/v/computers-en-software/desktop-pc-s/a1509615028-lenovo-thinkcentre-m70q-i5-8gb-ddr4-256gb-nvme-windows-11-10,Vandaag,Zo goed als nieuw,Lenovo,ThinkCentre M70q,Vandaag
HP t520 ThinClient| AMD GX-212JC| 16GB SSD| 4GB DDR3| Win7E,"€ 45,99",Specificaties: processor: amd gx-212jc 1.2Ghz geheugen: 4gb ddr3l opslag: 16gb ssd videokaart: amd radeon hd graphics verbinding (,https://www.marktplaats.nl/v/computers-en-software/desktop-pc-s/a1481767024-hp-t520-thinclient-amd-gx-212jc-16gb-ssd-4gb-ddr3-win7e,Vandaag,Zo goed als nieuw,HP,t520 ThinClient,Vandaag
HP EliteDesk 800 G8 mini | Core i5 / 16GB / 256GB SSD,"€ 537,00",Hp elitedesk 800 g8 mini zeer kleine en snelle pc met 11e generatie intel core i5 processor. Windows 11 compatible. Wordt geleverd,https://www.marktplaats.nl/v/computers-en-software/desktop-pc-s/a1508753349-hp-elitedesk-800-g8-mini-core-i5-16gb-256gb-ssd,Vandaag,Gebruikt,HP,EliteDesk 800 G8 mini,Vandaag
HP ProBook 640 G2 | Intel Core i5 | 8GB,"€ 170,00","De hp probook 640 g2 is een veelzijdige en robuuste zakelijke laptop, perfect voor professionals die een krachtige en betrouwbare",https://www.marktplaats.nl/v/computers-en-software/windows-laptops/a1508150205-hp-probook-640-g2-intel-core-i5-8gb,Vandaag,Zo goed als nieuw,HP,ProBook 640 G2,Vandaag
HP - PageWide Managed Color MFP P77940dn (Y3Z61A),"€ 1.095,00","Pagewide managed color mfp p77940dn (y3z61a) hp pagewide managed color mfp p77940dn (y3z61a), inkjet, 2400 x 1200 dpi, 550 vel, a3",https://www.marktplaats.nl/v/computers-en-software/printers/a1504389597-hp-pagewide-managed-color-mfp-p77940dn-y3z61a,Vandaag,Zo goed als nieuw,HP,PageWide Managed Color MFP P77940dn (Y3Z61A),Vandaag
HP 301XL originele high-capacity drie-kleuren inktcartridge,"€ 30,00","Hp 301xl originele high-capacity drie-kleuren inktcartridge. Type kleureninkt: pigmentgebaseerde inkt, inkjet cartridge type: hoog",https://www.marktplaats.nl/v/computers-en-software/printerbenodigdheden/m2225891297-hp-301xl-originele-high-capacity-drie-kleuren-inktcartridge,Vandaag,Nieuw,HP,301XL,Vandaag
A4 All In One Kleurenprinter Refurbished Garantie HP M575,"€ 599,00","Refurbished hp m575 mfp a4 all in one kleuren laserprinter inclusief garantie nu vanaf € 599,- excl. Btw. Gebruiksvriendelijk",https://www.marktplaats.nl/v/computers-en-software/printers/a1053527107-a4-all-in-one-kleurenprinter-refurbished-garantie-hp-m575,Vandaag,Zo goed als nieuw,HP,M575,Vandaag
Te Koop : HP 51A (HP Q7551A) tonercartridge,Bieden,Te koop : hp 51a (hp q7551a) tonercartridge heb ook nog een nieuwe hp 51x liggen geschikte printers: • hp laserjet m3027 • hp lase,https://www.marktplaats.nl/v/computers-en-software/printerbenodigdheden/m2224738207-te-koop-hp-51a-hp-q7551a-tonercartridge,18 jan 25,Nieuw,HP,51A (Q7551A),18 jan 25
HP - lj managed flow mfp e62565h (j8j74a),"€ 995,00","Lj managed flow mfp e62565h (j8j74a) ideal for 10-25 people printing 5,000 to 30,000 pages per month who need speed, energy effici",https://www.marktplaats.nl/v/computers-en-software/printers/a1497304289-hp-lj-managed-flow-mfp-e62565h-j8j74a,18 jan 25,Zo goed als nieuw,HP,lj managed flow mfp e62565h (j8j74a),18 jan 25
-= HP RF03XL Batterij - Originele laptopbatterij =-,"€ 25,00",-= hp rf03xl batterij - originele laptopbatterij =- -= specs =- model: hp rf03xl capaciteit: 41wh (11.4V) geschikt voor diverse hp,https://www.marktplaats.nl/v/computers-en-software/accu-s-en-batterijen/m2224343904-hp-rf03xl-batterij-originele-laptopbatterij,17 jan 25,Nieuw,HP,RF03XL,17 jan 25
HP - PageWide Managed Color Flow MFP E77660zs (2GP14A),"€ 1.595,00","Pagewide managed color flow mfp e77660zs (2gp14a) hp pagewide managed color flow mfp e77660zs (2gp14a) inkjet, 2400 x 1200 dpi, 55",https://www.marktplaats.nl/v/computers-en-software/printers/a1504314344-hp-pagewide-managed-color-flow-mfp-e77660zs-2gp14a,17 jan 25,Zo goed als nieuw,HP,PageWide Managed Color Flow MFP E77660zs (2GP14A),17 jan 25
Te Koop : HP Q6000A toner (zwart),Bieden,Te koop : hp q6000a toner (zwart) ook wel hp 124a genoemd geschikte printers : hp color laserjet 1600 hp color laserjet 2600 hp co,https://www.marktplaats.nl/v/computers-en-software/printerbenodigdheden/m2225131345-te-koop-hp-q6000a-toner-zwart,Eergisteren,Nieuw,HP,Q6000A,Eergisteren
Lenovo ThinkCentre tiny M80q Core i5-10500T 8GB 256GB NVMe,"€ 359,00",Welkom bij pc magnaat! Graag bieden wij u het volgende aan: merk : lenovo model serie: thinkcentre model type: m80q formaat: klein,https://www.marktplaats.nl/v/computers-en-software/desktop-pc-s/a1509614823-lenovo-thinkcentre-tiny-m80q-core-i5-10500t-8gb-256gb-nvme,Eergisteren,Zo goed als nieuw,Lenovo,ThinkCentre M80q,Eergisteren
HP - Lj managed mfp e825xx 40-50-60 engine (5CM58A),"€ 1.795,00",Lj managed mfp e825xx 40-50-60 engine (5cm58a) tcop bv(second hand hp) weerschip 10 3991 cr houten tel.: 030-2288022 Fax.: 030-225,https://www.marktplaats.nl/v/computers-en-software/printers/a1504389601-hp-lj-managed-mfp-e825xx-40-50-60-engine-5cm58a,17 jan 25,Nieuw,HP,5CM58A,17 jan 25
HP Keyboard L14377-211 met toetsen verlichting,"€ 42,50",Hp keyboard l14377-211 met toetstenbord verlichting. Hp laptop toetsenbord l14377-211 met achtergrondverlichting voor elitebook 84,https://www.marktplaats.nl/v/computers-en-software/toetsenborden/m2224910408-hp-keyboard-l14377-211-met-toetsen-verlichting,18 jan 25,Nieuw,HP,L14377-211,18 jan 25
HP - CLJ Enterprise 700 Color MPF M775z+ (CF304A),"€ 1.495,00","Clj enterprise 700 color mpf m775z+ (cf304a) - zeer uitgebreide kleuren multifuntional. - Printen, kopieren, scannen tot a3 formaa",https://www.marktplaats.nl/v/computers-en-software/printers/a1507252766-hp-clj-enterprise-700-color-mpf-m775z-cf304a,18 jan 25,Zo goed als nieuw,HP,CLJ Enterprise 700 Color MPF M775z+ (CF304A),18 jan 25
HP Ultraslim Keyed Cable Lock,"€ 7,00","Hp ultraslim keyed cable lock. Kleur van het product: zwart, slot type: ronde sleutel, materiaal: roestvrijstaal, vinyl. Snoerleng",https://www.marktplaats.nl/v/computers-en-software/pc-en-netwerkkabels/m2225218744-hp-ultraslim-keyed-cable-lock,Eergisteren,Nieuw,HP,Ultraslim Keyed Cable Lock,Eergisteren
HIGH END Game PC HP i7 NVIDIA RTX3060 12GB + 2 jaar,"€ 929,00",De refurbished high end game pc van alpha-shop is voorzien van 16gb ram en een ssd maar het is de 8e generatie i7 processor en nvi,https://www.marktplaats.nl/v/computers-en-software/desktop-pc-s/a1507378442-high-end-game-pc-hp-i7-nvidia-rtx3060-12gb-2-jaar,Eergisteren,Nieuw,HP,i7 NVIDIA RTX3060,Eergisteren
Touchpad voor HP ProBook 430 / 440 G5 G6 G7,"€ 15,00",Origineel touchpad voor hp probook 430 / 440 g5 g6 g7 (gebruikt en getest) te koop: een origineel touchpad voor diverse hp probook,https://www.marktplaats.nl/v/computers-en-software/muizen/m2224974377-touchpad-voor-hp-probook-430-440-g5-g6-g7,18 jan 25,Refurbished,HP,ProBook 430 / 440 G5 G6 G7,18 jan 25
HP - CLJ Enterprise color flow MFP M575c (CD646A),"€ 695,00","Clj enterprise color flow mfp m575c (cd646a) - zeer uitgebreide kleuren multifuntional. - Printen, kopieren, scannen tot a4 formaa",https://www.marktplaats.nl/v/computers-en-software/printers/a1501002932-hp-clj-enterprise-color-flow-mfp-m575c-cd646a,18 jan 25,Zo goed als nieuw,HP,CLJ Enterprise color flow MFP M575c (CD646A),18 jan 25
Te Koop : HP 302XL cartridges (zwart en Kleur),"€ 27,50","Te koop : hp 302xl cartridges (zwart en kleur) voor € 27,50 per cartridge geschikte printers : hp deskjet 1110 hp deskjet 111",https://www.marktplaats.nl/v/computers-en-software/printerbenodigdheden/m2224741145-te-koop-hp-302xl-cartridges-zwart-en-kleur,18 jan 25,Nieuw,HP,302XL,18 jan 25
HP - HP Laserjet Papierinvoerlade P4014/P4015/P4515-serie,"€ 50,00",- nog op voorraad:60 hp laserjet papierinvoerlade p4014/p4015/p4515-serie (cb518a) tcop bv(second hand hp) weerschip 10 3991 cr ho,https://www.marktplaats.nl/v/computers-en-software/printerbenodigdheden/a1497304150-hp-hp-laserjet-papierinvoerlade-p4014-p4015-p4515-serie,18 jan 25,Nieuw,HP,Laserjet Papierinvoerlade P4014/P4015/P4515-serie,18 jan 25
Hp 234441-051 adapter p55 rj11 to fra printer to network,"€ 5,00",Om een printer aan een lan netwerk te koppelen 234441-051 is compatible with: hp officejet 7500a wide format e-all-in-one printer,https://www.marktplaats.nl/v/computers-en-software/pc-en-netwerkkabels/m2225196707-hp-234441-051-adapter-p55-rj11-to-fra-printer-to-network,Eergisteren,Nieuw,Hp,234441-051,Eergisteren
HP - HP booklet finisher M855/M880 (A2W83A),"€ 995,00",Hp booklet finisher m855/m880 (a2w83a) overzichtmet hp color laserjet finishers met drie bakken vervaardigt u complexe documenten,https://www.marktplaats.nl/v/computers-en-software/printerbenodigdheden/a1497304397-hp-hp-booklet-finisher-m855-m880-a2w83a,Eergisteren,Nieuw,HP,HP booklet finisher M855/M880 (A2W83A),Eergisteren
P ProBook 440 G6/G7 & 445 G6/G7 Speakers (Links & Rechts) (G,"€ 5,00","Te koop: een set originele hp probook 440 g6/g7 & 445 g6/g7 speakers (links & rechts). Dit onderdeel is gebruikt, maar zor",https://www.marktplaats.nl/v/computers-en-software/pc-speakers/m2225210083-p-probook-440-g6-g7-445-g6-g7-speakers-links-rechts-g,Eergisteren,Gebruikt,HP,ProBook 440 G6/G7 & 445 G6/G7,Eergisteren
HP - (r73-6006),"€ 50,00",(r73-6006) tcop bv(second hand hp) weerschip 10 3991 cr houten tel.: 030-2288022 Fax.: 030-2250842 Bezichtiging en afhaal op afspr,https://www.marktplaats.nl/v/computers-en-software/printerbenodigdheden/a1497304187-hp-r73-6006,Eergisteren,Zo goed als nieuw,HP,r73-6006,Eergisteren
HP - papierlade lj 3390 / m2727 (q7556a),"€ 25,00",Papierlade lj 3390 / m2727 (q7556a) tcop bv(second hand hp) weerschip 10 3991 cr houten tel.: 030-2288022 Fax.: 030-2250842 Bezich,https://www.marktplaats.nl/v/computers-en-software/printerbenodigdheden/a1497304239-hp-papierlade-lj-3390-m2727-q7556a,16 jan 25,Zo goed als nieuw,HP,Papierlade lj 3390 / m2727 (Q7556A),16 jan 25
