Title,Price,Description,Link,Date,Usage,Brand,Model,ClassifiedDate
364XL 364 inktmedia huismerk inktcartridges geschikt voor HP,Zie omschrijving,364xl serie inktmedia huismerk (nieuw) geschikt voor hp printers zowel als set en los leverbaar. Deze cartridges zijn o a. Geschi,https://www.marktplaats.nl/v/computers-en-software/printerbenodigdheden/m2222850701-364xl-364-inktmedia-huismerk-inktcartridges-geschikt-voor-hp,13 jan 25,Nieuw,HP,364XL,13 jan 25
HP - Q6999A (CC516A) booklet finisher,"€ 295,00","Booklet maker finisher with output accessory bridge overview boekjesmaker/finisher met mogelijkheid tot nieten, boekjes maken en v",https://www.marktplaats.nl/v/computers-en-software/printerbenodigdheden/a1497304396-hp-q6999a-cc516a-booklet-finisher,13 jan 25,Zo goed als nieuw,HP,Q6999A (CC516A),13 jan 25
Te Koop : HP 302 cartridges (Kleur),"€ 12,50","Te koop : hp 302 cartridges (kleur) voor € 12,50 per cartridge nog 2 stuks aanwezig heb ook nog een aantal hp 302xl (zwart en",https://www.marktplaats.nl/v/computers-en-software/printerbenodigdheden/m2222500245-te-koop-hp-302-cartridges-kleur,12 jan 25,Nieuw,HP,302,12 jan 25
HP - designjet t770 1118-mm hdd (cn375a),"€ 1.195,00",Designjet t770 1118-mm hdd (cn375a) tcop bv(second hand hp) weerschip 10 3991 cr houten tel.: 030-2288022 Fax.: 030-2250842 Bezich,https://www.marktplaats.nl/v/computers-en-software/printers/a1497304308-hp-designjet-t770-1118-mm-hdd-cn375a,12 jan 25,Zo goed als nieuw,HP,designjet t770,12 jan 25
Inkt voor printer h300XL,"€ 15,00",Verkeerde gekocht.  Inhoud levering: inktcartridge geschikt voor hp 300xl: zwart: 16ml geschikt voor printers: hp deskjet d1660 hp,https://www.marktplaats.nl/v/computers-en-software/printerbenodigdheden/m2225300687-inkt-voor-printer-h300xl,Vandaag,Nieuw,HP,300XL,Vandaag
HP Probook 650 G2 Intel Core i5 6200U | 8GB | 256GB SSD |...,"€ 179,00","L&o computers maakt de verkoop van gebruikte ex-lease producten mogelijk door deze in de productieafdeling te controleren, tes",https://www.marktplaats.nl/v/computers-en-software/windows-laptops/a1509036822-hp-probook-650-g2-intel-core-i5-6200u-8gb-256gb-ssd,Eergisteren,Gebruikt,HP,Probook 650 G2,Eergisteren
HP Thunderbolt dock 230W G2,"€ 69,99",Welkom bij pc magnaat! Graag bieden wij u het volgende aan: merk : hp model: 2uk38aa hostinterface: thunderbolt 3 video in: 2x dis,https://www.marktplaats.nl/v/computers-en-software/dockingstations/a1509614916-hp-thunderbolt-dock-230w-g2,Eergisteren,Gebruikt,HP,Thunderbolt dock 230W G2,Eergisteren
HP ProBook 440 G3 | Intel Core i5 | 8GB,"€ 170,00","De hp probook 440 g3 is een betrouwbare en compacte zakelijke laptop, ideaal voor professionals die een balans zoeken tussen prest",https://www.marktplaats.nl/v/computers-en-software/windows-laptops/a1508150202-hp-probook-440-g3-intel-core-i5-8gb,Eergisteren,Zo goed als nieuw,HP,ProBook 440 G3,Eergisteren
Refurbished HP ProDesk 400 G4 MT met garantie,"€ 148,95","Hp prodesk 400 g4 mt core i5-7500, 8gb ddr4/256gb ssd, dvdrw, displayport+vga, win 10 pro met minimaal 2 jaar garantie uitgerust m",https://www.marktplaats.nl/v/computers-en-software/desktop-pc-s/a1507466637-refurbished-hp-prodesk-400-g4-mt-met-garantie,Eergisteren,Zo goed als nieuw,HP,ProDesk 400 G4 MT,Eergisteren
HP 400 G3 Mini | Core i5 / 8GB / 256GB SSD,"€ 149,00",Hp prodesk 400 g3 dm mini zeer kleine en snelle pc met een 7e generatie intel core i5 processor. Inclusief adapter en netsnoer. Pr,https://www.marktplaats.nl/v/computers-en-software/desktop-pc-s/a1494089375-hp-400-g3-mini-core-i5-8gb-256gb-ssd,Eergisteren,Gebruikt,HP,400 G3 Mini,Eergisteren
HP - Q6999A (CC516A) booklet finisher,"€ 295,00","Booklet maker finisher with output accessory bridge overview boekjesmaker/finisher met mogelijkheid tot nieten, boekjes maken en v",https://www.marktplaats.nl/v/computers-en-software/printerbenodigdheden/a1497304396-hp-q6999a-cc516a-booklet-finisher,Eergisteren,Zo goed als nieuw,HP,Q6999A (CC516A),Eergisteren
HP laptop oplader,"€ 18,00","Nieuw: oplader voor hp laptop. Reden verkoop : verkeerde voltage gekocht, bon te voorbarig weggegooid, waardoor ik hem niet meer r",https://www.marktplaats.nl/v/computers-en-software/laptop-opladers/m2225405941-hp-laptop-oplader,Eergisteren,Nieuw,HP,Unknown,Eergisteren
HP - formatter cm6040/6040f mfp (q3938-67977),"€ 275,00",Formatter cm6040/6040f mfp (q3938-67977) tcop bv(second hand hp) weerschip 10 3991 cr houten tel.: 030-2288022 Fax.: 030-2250842 B,https://www.marktplaats.nl/v/computers-en-software/printerbenodigdheden/a1497304196-hp-formatter-cm6040-6040f-mfp-q3938-67977,Eergisteren,Zo goed als nieuw,HP,cm6040/6040f mfp (q3938-67977),Eergisteren
"HP - touch screen hp m525,m575,m725 (cd644-67916)","€ 295,00","Touch screen hp m525,m575,m725 (cd644-67916) tcop bv(second hand hp) weerschip 10 3991 cr houten tel.: 030-2288022 Fax.: 030-22508",https://www.marktplaats.nl/v/computers-en-software/printerbenodigdheden/a1497304206-hp-touch-screen-hp-m525-m575-m725-cd644-67916,Eergisteren,Zo goed als nieuw,HP,"touch screen m525,m575,m725 (cd644-67916)",Eergisteren
HP - Jetdirect 640n (J8025A),"€ 100,00",Jetdirect 640n (j8025a) hp printer server: jetdirect 640n ipv6/ipsec print server card - zwart kenmerken de hp jetdirect 640n is e,https://www.marktplaats.nl/v/computers-en-software/printerbenodigdheden/a1497304406-hp-jetdirect-640n-j8025a,Vandaag,Zo goed als nieuw,HP,Jetdirect 640n (J8025A),Vandaag
A3 Kleuren Laserprinter All In One HP M880 Garantie on site,"€ 2.495,00","Nu van €7.750,- Voor €2.495,- Excl. Btw. Op = op. Refurbished zeer professionele a3 multifunctional color laserjet inclu",https://www.marktplaats.nl/v/computers-en-software/printers/a1099526785-a3-kleuren-laserprinter-all-in-one-hp-m880-garantie-on-site,Vandaag,Zo goed als nieuw,HP,M880,Vandaag
HP - hp 2x 500-sheet+1500-sheet paper feeder (cz263a),"€ 195,00",Hp 2x 500-sheet+1500-sheet paper feeder (cz263a) tcop bv(second hand hp) weerschip 10 3991 cr houten tel.: 030-2288022 Fax.: 030-2,https://www.marktplaats.nl/v/computers-en-software/printerbenodigdheden/a1497304260-hp-hp-2x-500-sheet-1500-sheet-paper-feeder-cz263a,Eergisteren,Zo goed als nieuw,HP,CZ263A,Eergisteren
HP printer,"€ 35,00",Hp deskjetprinter  3760 all in one. Pas aangeschaft eind 2023. Omdat ik een andere  flatscan printer gekocht heb verkoop ik deze p,https://www.marktplaats.nl/v/computers-en-software/printers/m2223906086-hp-printer,Eergisteren,Zo goed als nieuw,HP,DeskJet 3760,Eergisteren
HP Z440 Workstation | XEON / 16GB ram / 256GB SSD,"€ 179,00","Hp z440 workstation zeer krachtige tower pc, voorzien van een intel xeon processor en 256gb ssd deze pc beschikt over een quadro k",https://www.marktplaats.nl/v/computers-en-software/desktop-pc-s/a1497307768-hp-z440-workstation-xeon-16gb-ram-256gb-ssd,Eergisteren,Gebruikt,HP,Z440,Eergisteren
HP Elitebook 830 G7 | Intel i5 | 256 SSD | 16 GB | NIEUW,"€ 599,00",Hp elitebook 830 g7 nieuw in gesealde doos garantie : 24 mnd. Garantie processor : intel i5 10210u intern geheugen : 16 gb ddr4 ha,https://www.marktplaats.nl/v/computers-en-software/windows-laptops/a1459615465-hp-elitebook-830-g7-intel-i5-256-ssd-16-gb-nieuw,Gisteren,Nieuw,HP,Elitebook 830 G7,Gisteren
HP - HP Laserjet Papierinvoerlade P4014/P4015/P4515-serie,"€ 50,00",- nog op voorraad:60 hp laserjet papierinvoerlade p4014/p4015/p4515-serie (cb518a) tcop bv(second hand hp) weerschip 10 3991 cr ho,https://www.marktplaats.nl/v/computers-en-software/printerbenodigdheden/a1497304150-hp-hp-laserjet-papierinvoerlade-p4014-p4015-p4515-serie,18 jan 25,Nieuw,HP,Laserjet Papierinvoerlade P4014/P4015/P4515-serie,18 jan 25
HP - HP Laserjet 550 Vel Papierlade (CF404A),"€ 79,00",- nog op voorraad:6 geschikt voor : color laserjet pro m452dn color laserjet pro m452dw color laserjet pro m452nw color laserjet p,https://www.marktplaats.nl/v/computers-en-software/printerbenodigdheden/a1497304283-hp-hp-laserjet-550-vel-papierlade-cf404a,16 jan 25,Nieuw,HP,Laserjet 550,16 jan 25
HP - CLJ printerkast voor M577 MFP (B5L51A),"€ 95,00",Clj printerkast voor m577 mfp (b5l51a) de robuuste bijpassende hp printerkast maakt het mogelijk de printer zo te plaatsen dat dez,https://www.marktplaats.nl/v/computers-en-software/printerbenodigdheden/a1509945558-hp-clj-printerkast-voor-m577-mfp-b5l51a,Eergisteren,Zo goed als nieuw,HP,B5L51A,Eergisteren
HP Laserprinter Pro M281 fdw incl.5 cartridges 80% en 100%,"€ 325,00","Mooie hp pro m281 fdw laserprinter, werkt prima. Incl 5 cartridges 2 203x zwart 80 % en 100 %                              1 203x",https://www.marktplaats.nl/v/computers-en-software/printers/m2224963201-hp-laserprinter-pro-m281-fdw-incl-5-cartridges-80-en-100,Vandaag,Zo goed als nieuw,HP,Laserprinter Pro M281 fdw,Vandaag
HP - Q6998A (CC517A) finisher (For CM6030/CM6040),"€ 295,00",Hp color laserjet 3-baks uitvoer/nietmachine kenmerken hp color laserjet 3-bin stapler/stacker overview deze 3-baks uitvoereenheid,https://www.marktplaats.nl/v/computers-en-software/printerbenodigdheden/a1497304296-hp-q6998a-cc517a-finisher-for-cm6030-cm6040,Vandaag,Zo goed als nieuw,HP,Q6998A (CC517A),Vandaag
HP - lade voor P2015,"€ 30,00",Extra lade voor hp laserjet p2015 tcop bv(second hand hp) weerschip 10 3991 cr houten tel.: 030-2288022 Fax.: 030-2250842 Bezichti,https://www.marktplaats.nl/v/computers-en-software/printerbenodigdheden/a1497304227-hp-lade-voor-p2015,Eergisteren,Zo goed als nieuw,HP,P2015,Eergisteren
HP Elitebook 845 G9 AMD Ryzen5Pro TOUCH 16/512SSD Office365,"€ 575,00",Zgan zeer fraaie en krachtige hp elitebook 845 g9 amd ryzen 5 pro 16/512ssd touchscreen en face-herkenning / toetsenbordverlichtin,https://www.marktplaats.nl/v/computers-en-software/windows-laptops/m2225406323-hp-elitebook-845-g9-amd-ryzen5pro-touch-16-512ssd-office365,Eergisteren,Zo goed als nieuw,HP,Elitebook 845 G9,Eergisteren
HP - HP LaserJet papierlade voor 550 vel (L0H17A),"€ 95,00",- nog op voorraad:11 hp laserjet papierlade voor 550 vel (l0h17a) tcop bv(second hand hp) weerschip 10 3991 cr houten tel.: 030-22,https://www.marktplaats.nl/v/computers-en-software/printerbenodigdheden/a1497304337-hp-hp-laserjet-papierlade-voor-550-vel-l0h17a,Eergisteren,Nieuw,HP,LaserJet papierlade (L0H17A),Eergisteren
HP - 2.000vel papierlade en standaard (y1f99a),"€ 795,00",2.000Vel papierlade en standaard (y1f99a) tcop bv(second hand hp) weerschip 10 3991 cr houten tel.: 030-2288022 Fax.: 030-2250842,https://www.marktplaats.nl/v/computers-en-software/printerbenodigdheden/a1497304317-hp-2-000vel-papierlade-en-standaard-y1f99a,Gisteren,Nieuw,HP,y1f99a,Gisteren
computer,Bieden,"Hp prodesk 400 g3 i5-6500/8gb/ssd/hdd/ vid.krt.2Gb 4 x een snelle, stille en betrouwbare hp pc's. Zonder mankementen en helema",https://www.marktplaats.nl/v/computers-en-software/desktop-pc-s/m2225868026-computer,Vandaag,Zo goed als nieuw,Hp,prodesk 400 g3,Vandaag
HP Probook 650 G2 Intel Core i5 6200U | 8GB | 256GB SSD |...,"€ 199,00","L&o computers maakt de verkoop van gebruikte ex-lease producten mogelijk door deze in de productieafdeling te controleren, tes",https://www.marktplaats.nl/v/computers-en-software/windows-laptops/a1509036817-hp-probook-650-g2-intel-core-i5-6200u-8gb-256gb-ssd,18 jan 25,Zo goed als nieuw,HP,Probook 650 G2,18 jan 25
HP EliteBook Folio 1040 G2 | Intel Core i5 | 8GB,"€ 245,00","De hp elitebook folio 1040 g2 is een elegante en lichte zakelijke laptop, ideaal voor professionals die onderweg zijn. Met een 14-",https://www.marktplaats.nl/v/computers-en-software/windows-laptops/a1506575069-hp-elitebook-folio-1040-g2-intel-core-i5-8gb,18 jan 25,Gebruikt,HP,EliteBook Folio 1040 G2,18 jan 25
Refurbished HP ProDesk 400 G4 MT met garantie,"€ 134,95","Hp prodesk 400 g4 mt core i5-7500, 8gb ddr4/256gb ssd, dvdrw, displayport+vga, win 10 pro met minimaal 2 jaar garantie uitgerust m",https://www.marktplaats.nl/v/computers-en-software/desktop-pc-s/a1507512817-refurbished-hp-prodesk-400-g4-mt-met-garantie,18 jan 25,Gebruikt,HP,ProDesk 400 G4 MT,18 jan 25
HP HPE ProLiant DL360 DL380 ML350 Gen8 Gen9 Gen10 Gen10+,"€ 69,00",Serverzaak.nl levert diverse merken en modellen refurbished servers volledig getest met garantie. Stel uw eigen server samen op on,https://www.marktplaats.nl/v/computers-en-software/servers/a1348926231-hp-hpe-proliant-dl360-dl380-ml350-gen8-gen9-gen10-gen10,18 jan 25,Zo goed als nieuw,HP,HPE ProLiant DL360 DL380 ML350 Gen8 Gen9 Gen10 Gen10+,18 jan 25
HP ProBook 440 G6 Core i5-8265U 8GB DDR4 512GB SSD W11,"€ 249,99",Hp probook 440 g6 core i5-8265u 8gb ddr4 512gb ssd w11 hp probook 440 g6 intel core | i5-8265u (max. 3.9Ghz) 14.1 Inch full hd ips,https://www.marktplaats.nl/v/computers-en-software/windows-laptops/a1507113746-hp-probook-440-g6-core-i5-8265u-8gb-ddr4-512gb-ssd-w11,18 jan 25,Gebruikt,HP,ProBook 440 G6,18 jan 25
A3 Kleuren Laserprinter All In One HP M880 Garantie on site,"€ 2.495,00","Nu van €7.750,- Voor €2.495,- Excl. Btw. Op = op. Refurbished zeer professionele a3 multifunctional color laserjet inclu",https://www.marktplaats.nl/v/computers-en-software/printers/a1099526785-a3-kleuren-laserprinter-all-in-one-hp-m880-garantie-on-site,18 jan 25,Zo goed als nieuw,HP,M880,18 jan 25
HP - HP LaserJet 500-Sheet Paper Tray (CZ261A),"€ 225,00",- nog op voorraad:3 hp laserjet 500-sheet paper tray (cz261a) tcop bv(second hand hp) weerschip 10 3991 cr houten tel.: 030-228802,https://www.marktplaats.nl/v/computers-en-software/printerbenodigdheden/a1497304271-hp-hp-laserjet-500-sheet-paper-tray-cz261a,18 jan 25,Nieuw,HP,LaserJet 500-Sheet Paper Tray (CZ261A),18 jan 25
HP t5740e Thin Client| 4GB SSD| 4GB DDR3| Win7E,"€ 19,95","Hp t5740e thin client processor: intel atom n280 1,66ghz geheugen: 4gb ddr3 opslag: 4gb ssd flash videokaart: intel mobile gl40 ve",https://www.marktplaats.nl/v/computers-en-software/desktop-pc-s/a1480920979-hp-t5740e-thin-client-4gb-ssd-4gb-ddr3-win7e,Eergisteren,Zo goed als nieuw,HP,t5740e Thin Client,Eergisteren
HP - pagewide enterprise cabinet and stand (g1w44a),"€ 195,00",Pagewide enterprise cabinet and stand (g1w44a) tcop bv(second hand hp) weerschip 10 3991 cr houten tel.: 030-2288022 Fax.: 030-225,https://www.marktplaats.nl/v/computers-en-software/printerbenodigdheden/a1497304264-hp-pagewide-enterprise-cabinet-and-stand-g1w44a,Gisteren,Zo goed als nieuw,HP,G1W44A,Gisteren
HP - 3x550-sheet feeder and stand (p1b11a),"€ 695,00","3x550-sheet feeder and stand (p1b11a) geschikt voor: hp color laserjet enterprise m652n j7z98a, hp color laserjet enterprise m652d",https://www.marktplaats.nl/v/computers-en-software/printerbenodigdheden/a1497304219-hp-3x550-sheet-feeder-and-stand-p1b11a,Gisteren,Zo goed als nieuw,HP,3x550-sheet feeder and stand (p1b11a),Gisteren
HP - printer stand (for 4250/4350 (q2445b),"€ 60,00",Printer stand (for 4250/4350 (q2445b) tcop bv(second hand hp) weerschip 10 3991 cr houten tel.: 030-2288022 Fax.: 030-2250842 Bezi,https://www.marktplaats.nl/v/computers-en-software/printerbenodigdheden/a1497304205-hp-printer-stand-for-4250-4350-q2445b,17 jan 25,Zo goed als nieuw,HP,q2445b,17 jan 25
"Refurbished laptop scherm HD 15,6 inch(1366x768)","€ 19,99",Welkom bij pc magnaat! Graag bieden wij u het volgende aan: merk : type product: laptopscherm formaat: 15.6 Inch resolutie: 1366x7,https://www.marktplaats.nl/v/computers-en-software/windows-laptops/a1509614855-refurbished-laptop-scherm-hd-15-6-inch-1366x768,18 jan 25,Gebruikt,Unknown,Unknown,18 jan 25
"HP - touch screen hp m525,m575,m725 (cd644-67916)","€ 295,00","Touch screen hp m525,m575,m725 (cd644-67916) tcop bv(second hand hp) weerschip 10 3991 cr houten tel.: 030-2288022 Fax.: 030-22508",https://www.marktplaats.nl/v/computers-en-software/printerbenodigdheden/a1497304206-hp-touch-screen-hp-m525-m575-m725-cd644-67916,18 jan 25,Zo goed als nieuw,HP,"m525, m575, m725 (cd644-67916)",18 jan 25
HP - 2x520sh Dept PaperTray/Stand E877 series (6GW47A),"€ 495,00",Geschikt voor de nieuwe e877 e826 series van hp plus & minpunten: * 2 x 500 vel lade met onderstel tcop bv(second hand hp) wee,https://www.marktplaats.nl/v/computers-en-software/printerbenodigdheden/a1497304372-hp-2x520sh-dept-papertray-stand-e877-series-6gw47a,16 jan 25,Zo goed als nieuw,HP,2x520sh Dept PaperTray/Stand E877 series (6GW47A),16 jan 25
HP - pagewide enterprise cabinet and stand (g1w44a),"€ 395,00",Pagewide enterprise cabinet and stand (g1w44a) tcop bv(second hand hp) weerschip 10 3991 cr houten tel.: 030-2288022 Fax.: 030-225,https://www.marktplaats.nl/v/computers-en-software/printerbenodigdheden/a1497304282-hp-pagewide-enterprise-cabinet-and-stand-g1w44a,Eergisteren,Nieuw,HP,pagewide enterprise cabinet and stand (g1w44a),Eergisteren
HP - 2x2000 sheet papertray and stand (p1v19a),"€ 995,00",2x2000 sheet papertray and stand (p1v19a) tcop bv(second hand hp) weerschip 10 3991 cr houten tel.: 030-2288022 Fax.: 030-2250842,https://www.marktplaats.nl/v/computers-en-software/printerbenodigdheden/a1497304231-hp-2x2000-sheet-papertray-and-stand-p1v19a,17 jan 25,Nieuw,HP,p1v19a,17 jan 25
Lenovo Tiny M720q i5 8GB DDR4 256GB NVMe Windows 11/10,"€ 279,00",Welkom bij pc magnaat! Graag bieden wij u het volgende aan: merk : lenovo model: thinkcentre m720q formaat: klein (tiny) processor,https://www.marktplaats.nl/v/computers-en-software/desktop-pc-s/a1509614869-lenovo-tiny-m720q-i5-8gb-ddr4-256gb-nvme-windows-11-10,16 jan 25,Zo goed als nieuw,Lenovo,ThinkCentre M720q,16 jan 25
HP - LaserJet Stapler/Stackerfor M806 / M830 (CZ994A),"€ 1.995,00",Compatibel producten: hp laserjet enterprise m806x+ nfc/wireless direct printer (d7p69a) hp laserjet enterprise m806dn printer (cz,https://www.marktplaats.nl/v/computers-en-software/printerbenodigdheden/a1497304392-hp-laserjet-stapler-stackerfor-m806-m830-cz994a,Eergisteren,Nieuw,HP,LaserJet Stapler/Stackerfor M806 / M830 (CZ994A),Eergisteren
"HP - Booklet Maker/Finisher (CZ285A) for M806, M830","€ 1.495,00","Booklet maker/finisher (cz285a) for m806, m830 tcop bv(second hand hp) weerschip 10 3991 cr houten tel.: 030-2288022 Fax.: 030-225",https://www.marktplaats.nl/v/computers-en-software/printerbenodigdheden/a1497304360-hp-booklet-maker-finisher-cz285a-for-m806-m830,Eergisteren,Zo goed als nieuw,HP,Booklet Maker/Finisher CZ285A,Eergisteren
HP t520 ThinClient| AMD GX-212JC| 16GB SSD| 4GB DDR3| Win8,"€ 45,99",Specificaties: processor: amd gx-212jc 1.2Ghz geheugen: 4gb ddr3l opslag: 16gb ssd videokaart: amd radeon hd graphics verbinding (,https://www.marktplaats.nl/v/computers-en-software/desktop-pc-s/a1481767020-hp-t520-thinclient-amd-gx-212jc-16gb-ssd-4gb-ddr3-win8,Vandaag,Zo goed als nieuw,HP,t520 ThinClient,Vandaag
HP Probook 650 G5 Intel Core i5 8265U | 8GB | 256GB SSD |...,"€ 239,00","Nu in de aanbieding van € 299,00 voor € 239,00! L&o computers maakt de verkoop van gebruikte ex-lease producten moge",https://www.marktplaats.nl/v/computers-en-software/windows-laptops/a1508507582-hp-probook-650-g5-intel-core-i5-8265u-8gb-256gb-ssd,18 jan 25,Gebruikt,HP,Probook 650 G5,18 jan 25
HP Pavilion 15-eg2852nd | Intel Core i7 | 16GB,"€ 625,00",De hp pavilion 15-eg2852nd is een krachtige laptop die ideaal is voor zowel werk als entertainment. Deze laptop heeft alleen als s,https://www.marktplaats.nl/v/computers-en-software/windows-laptops/a1508870734-hp-pavilion-15-eg2852nd-intel-core-i7-16gb,18 jan 25,Zo goed als nieuw,HP,Pavilion 15-eg2852nd,18 jan 25
HP Zbook Fury 16 G10 | Intel i7 | 64 GB | 1 TB | Nvidia 3500,"€ 2.250,00","Hp zbook fury 16 g10 refurbished a+ grade, kan een minimaal spoortje hebben. Vrijwel in nieuwstaat. Processor : intel i7 13700hx i",https://www.marktplaats.nl/v/computers-en-software/windows-laptops/a1509611621-hp-zbook-fury-16-g10-intel-i7-64-gb-1-tb-nvidia-3500,18 jan 25,Refurbished,HP,Zbook Fury 16 G10,18 jan 25
HP - ac usb proximity reader (cz208a),"€ 75,00",Ac usb proximity reader (cz208a) productinformatiehp access control usb proximity reader overzicht van de oplossing bescherm de ve,https://www.marktplaats.nl/v/computers-en-software/printerbenodigdheden/a1497304248-hp-ac-usb-proximity-reader-cz208a,18 jan 25,Zo goed als nieuw,HP,cz208a,18 jan 25
HP ZBook FireFly 14 G7 | i7 | 32 Gb | 512 Gb SSD | Quadro,"€ 399,00",It bedrijf biedt aan: een zeer nette en complete hp zbook firefly 14 g7. De laptop is volledig gecontroleerd en voorzien van de la,https://www.marktplaats.nl/v/computers-en-software/windows-laptops/a1509782556-hp-zbook-firefly-14-g7-i7-32-gb-512-gb-ssd-quadro,18 jan 25,Refurbished,HP,ZBook FireFly 14 G7,18 jan 25
HP t520 ThinClient| AMD GX-212JC| 16GB SSD| 4GB DDR3| Win8,"€ 45,99",Specificaties: processor: amd gx-212jc 1.2Ghz geheugen: 4gb ddr3l opslag: 16gb ssd videokaart: amd radeon hd graphics verbinding (,https://www.marktplaats.nl/v/computers-en-software/desktop-pc-s/a1481767020-hp-t520-thinclient-amd-gx-212jc-16gb-ssd-4gb-ddr3-win8,18 jan 25,Zo goed als nieuw,HP,t520 ThinClient,18 jan 25
"PC HP DX2400, Pentium 1,8GHz, 4GB, 240GB, tbord, muis, moni","€ 40,00","Nette pc hp dx240 cpu: intel pentium e2160 1,8 ghz ram: 4 gb hdd: 240 gb proview monitor 1440x900 60 hz hp toetsenbord muis voor o",https://www.marktplaats.nl/v/computers-en-software/desktop-pc-s/m2224884912-pc-hp-dx2400-pentium-1-8ghz-4gb-240gb-tbord-muis-moni,18 jan 25,Gebruikt,HP,DX2400,18 jan 25
HP - HP LaserJet papierinvoer/lade voor 500 vel (CF284A),"€ 50,00",- nog op voorraad:50 hp laserjet papierinvoer/lade voor 500 vel (cf284a) voor m401 serie tcop bv(second hand hp) weerschip 10 3991,https://www.marktplaats.nl/v/computers-en-software/printerbenodigdheden/a1497304156-hp-hp-laserjet-papierinvoer-lade-voor-500-vel-cf284a,18 jan 25,Nieuw,HP,LaserJet,18 jan 25
HP - stapler/stacker finisher 3 x 5000 nietjes (y1g14a),"€ 179,00",Stapler/stacker finisher 3 x 5000 nietjes (y1g14a) tcop bv(second hand hp) weerschip 10 3991 cr houten tel.: 030-2288022 Fax.: 030,https://www.marktplaats.nl/v/computers-en-software/printerbenodigdheden/a1497304340-hp-stapler-stacker-finisher-3-x-5000-nietjes-y1g14a,Vandaag,Nieuw,HP,y1g14a,Vandaag
HP - 900-sheet 3-bin stapling mailbox (b3m76a),"€ 250,00",900-sheet 3-bin stapling mailbox (b3m76a) tcop bv(second hand hp) weerschip 10 3991 cr houten tel.: 030-2288022 Fax.: 030-2250842,https://www.marktplaats.nl/v/computers-en-software/printerbenodigdheden/a1499196390-hp-900-sheet-3-bin-stapling-mailbox-b3m76a,18 jan 25,Nieuw,HP,b3m76a,18 jan 25
HP - Lade HP2015 (q5931a),"€ 35,00",- nog op voorraad:16 lade hp2015 (q5931a) tcop bv(second hand hp) weerschip 10 3991 cr houten tel.: 030-2288022 Fax.: 030-2250842,https://www.marktplaats.nl/v/computers-en-software/printerbenodigdheden/a1497304173-hp-lade-hp2015-q5931a,Eergisteren,Nieuw,HP,HP2015 (q5931a),Eergisteren
A4 Zwart Wit Laser Printer All In One Garantie HP M527dn MFP,"€ 349,00","Refurbised a4 all in one zwart/wit laser vanaf € 349,- incl. Garantie, excl. Btw (nieuwprijs vanaf € 1.399,- Excl. Btw)",https://www.marktplaats.nl/v/computers-en-software/printers/a1292674128-a4-zwart-wit-laser-printer-all-in-one-garantie-hp-m527dn-mfp,Eergisteren,Zo goed als nieuw,HP,M527dn MFP,Eergisteren
De goedkoopste inkt cartridges en toners voor uw printer.!,"€ 0,69",Pas op! Voor aanbieders die inkt cartridges zeer goedkoop aanbieden. Het verschil zit in de inhoud en vooral de kwaliteit inkt die,https://www.marktplaats.nl/v/computers-en-software/printers/a1000935603-de-goedkoopste-inkt-cartridges-en-toners-voor-uw-printer,14 jan 25,Nieuw,Unknown,Unknown,2025-01-14
Lenovo ThinkCentre M70q i5 8GB DDR4 256GB NVMe Windows 11/10,"€ 379,00",Welkom bij pc magnaat! Graag bieden wij u het volgende aan: merk : lenovo model serie: thinkcentre model type: m70q formaat: klein,https://www.marktplaats.nl/v/computers-en-software/desktop-pc-s/a1509615028-lenovo-thinkcentre-m70q-i5-8gb-ddr4-256gb-nvme-windows-11-10,15 jan 25,Zo goed als nieuw,Lenovo,ThinkCentre M70q,15 jan 25
HP - lade voor P2015,"€ 30,00",Extra lade voor hp laserjet p2015 tcop bv(second hand hp) weerschip 10 3991 cr houten tel.: 030-2288022 Fax.: 030-2250842 Bezichti,https://www.marktplaats.nl/v/computers-en-software/printerbenodigdheden/a1497304227-hp-lade-voor-p2015,Eergisteren,Zo goed als nieuw,HP,LaserJet P2015,Eergisteren
HP - tray for 4345 / m4345 (q5968a),"€ 75,00",Tray for 4345 / m4345 (q5968a) tcop bv(second hand hp) weerschip 10 3991 cr houten tel.: 030-2288022 Fax.: 030-2250842 Bezichtigin,https://www.marktplaats.nl/v/computers-en-software/printerbenodigdheden/a1497304192-hp-tray-for-4345-m4345-q5968a,Gisteren,Zo goed als nieuw,HP,4345 / m4345 (q5968a),Gisteren
HP - cp5525-m775 3x500-sheet feeder and stand (cf242a),"€ 250,00",Cp5525-m775 3x500-sheet feeder and stand (cf242a) tcop bv(second hand hp) weerschip 10 3991 cr houten tel.: 030-2288022 Fax.: 030-,https://www.marktplaats.nl/v/computers-en-software/printerbenodigdheden/a1497304348-hp-cp5525-m775-3x500-sheet-feeder-and-stand-cf242a,15 jan 25,Zo goed als nieuw,HP,cp5525-m775,15 jan 25
HP - PageWide Enterprise papierlade voor 3x500 vel en,"€ 295,00","- nog op voorraad:21 hp printerkast: pagewide enterprise papierlade voor 3x500 vel en standaard - zwart, grijs kenmerken pagewide",https://www.marktplaats.nl/v/computers-en-software/printerbenodigdheden/a1497304284-hp-pagewide-enterprise-papierlade-voor-3x500-vel-en,15 jan 25,Nieuw,HP,PageWide Enterprise,15 jan 25
HP Printer Adapter ( 0950-4397 ),"€ 9,00",Te koop aangeboden een hp printer adapter ( 0950-4397 ) . Specificaties : merk : hp model no : 0950-4397 output : 32 v / 500 ma /,https://www.marktplaats.nl/v/computers-en-software/printers/m2223148346-hp-printer-adapter-0950-4397,14 jan 25,Zo goed als nieuw,HP,0950-4397,14 jan 25
