Title,Price,Description,Link,Date,Usage
HP - duplexmodule (c8258a),"€ 20,00",Duplexmodule (c8258a) tcop bv(second hand hp) weerschip 10 3991 cr houten tel.: 030-2288022 Fax.: 030-2250842 Bezichtiging en afha,https://www.marktplaats.nl/v/computers-en-software/printerbenodigdheden/a1497304246-hp-duplexmodule-c8258a,Vandaag,Zo goed als nieuw
"HP - extra 256mb for cm6030,cm6040,cm6049 (q7558a)","€ 125,00","Extra 256mb for cm6030,cm6040,cm6049 (q7558a) tcop bv(second hand hp) weerschip 10 3991 cr houten tel.: 030-2288022 Fax.: 030-2250",https://www.marktplaats.nl/v/computers-en-software/printerbenodigdheden/a1497304207-hp-extra-256mb-for-cm6030-cm6040-cm6049-q7558a,Vandaag,Zo goed als nieuw
HP - Designjet T770 PostScript Upgrade Kit (CN500A),"€ 795,00",Designjet t770 postscript upgrade kit (cn500a) tcop bv(second hand hp) weerschip 10 3991 cr houten tel.: 030-2288022 Fax.: 030-225,https://www.marktplaats.nl/v/computers-en-software/printerbenodigdheden/a1497304383-hp-designjet-t770-postscript-upgrade-kit-cn500a,Vandaag,Zo goed als nieuw
HP - Main Board DesignJet Z6100 (Q6651-60209),"€ 250,00",Main board designjet z6100 (q6651-60209) tcop bv(second hand hp) weerschip 10 3991 cr houten tel.: 030-2288022 Fax.: 030-2250842 B,https://www.marktplaats.nl/v/computers-en-software/printerbenodigdheden/a1497304139-hp-main-board-designjet-z6100-q6651-60209,Vandaag,Zo goed als nieuw
HP - nfc/wireless direct 1200w mobile print accessory,"€ 35,00",Nfc/wireless direct 1200w mobile print accessory (e5k46a) tcop bv(second hand hp) weerschip 10 3991 cr houten tel.: 030-2288022 Fa,https://www.marktplaats.nl/v/computers-en-software/printerbenodigdheden/a1497304251-hp-nfc-wireless-direct-1200w-mobile-print-accessory,Vandaag,Zo goed als nieuw
HP - Designjet Z6100 Slide in Card (Q1273-20207),"€ 50,00",Designjet z6100 slide in card (q1273-20207) tcop bv(second hand hp) weerschip 10 3991 cr houten tel.: 030-2288022 Fax.: 030-225084,https://www.marktplaats.nl/v/computers-en-software/printerbenodigdheden/a1497304141-hp-designjet-z6100-slide-in-card-q1273-20207,Vandaag,Zo goed als nieuw
HP - (q3701a),"€ 125,00",(q3701a) tcop bv(second hand hp) weerschip 10 3991 cr houten tel.: 030-2288022 Fax.: 030-2250842 Bezichtiging en afhaal op afspraa,https://www.marktplaats.nl/v/computers-en-software/printerbenodigdheden/a1497304200-hp-q3701a,Vandaag,Zo goed als nieuw
HP - DesignJet Z6100ps Circut Board Omas Controller,"€ 50,00",Designjet z6100ps circut board omas controller (q6651-60156) tcop bv(second hand hp) weerschip 10 3991 cr houten tel.: 030-2288022,https://www.marktplaats.nl/v/computers-en-software/printerbenodigdheden/a1497304142-hp-designjet-z6100ps-circut-board-omas-controller,Gisteren,Zo goed als nieuw
"HP - memory 512mb, 200p ddr 167mhz (q7559a)","€ 125,00","Memory 512mb, 200p ddr 167mhz (q7559a) tcop bv(second hand hp) weerschip 10 3991 cr houten tel.: 030-2288022 Fax.: 030-2250842 Bez",https://www.marktplaats.nl/v/computers-en-software/printerbenodigdheden/a1497304201-hp-memory-512mb-200p-ddr-167mhz-q7559a,Gisteren,Zo goed als nieuw
HP - lj 1 gb 90-pin ddr3 dimm modul (g6w84a),"€ 295,00",Lj 1 gb 90-pin ddr3 dimm modul (g6w84a) tcop bv(second hand hp) weerschip 10 3991 cr houten tel.: 030-2288022 Fax.: 030-2250842 Be,https://www.marktplaats.nl/v/computers-en-software/printerbenodigdheden/a1497304232-hp-lj-1-gb-90-pin-ddr3-dimm-modul-g6w84a,Vandaag,Nieuw
HP - JETDIRECT CONNECTIVITY CARD (J4315A),"€ 40,00","This jetdirect connectivity card has usb, serial and localtalk connectors and comes with a manual and software. Tcop bv(second han",https://www.marktplaats.nl/v/computers-en-software/printerbenodigdheden/a1497304166-hp-jetdirect-connectivity-card-j4315a,Vandaag,Zo goed als nieuw
Lenovo ThinkPad DK1633 USB-C docking station,"€ 59,99","Lenovo thinkpad dk1633 docking station optimaliseer je werkruimte met het lenovo dk1633 dockstation - veelzijdig, krachtig, en com",https://www.marktplaats.nl/v/computers-en-software/dockingstations/a1505956297-lenovo-thinkpad-dk1633-usb-c-docking-station,Vandaag,Refurbished
HP Elitebook 820 G3 Intel Core i5 6200U | 8GB | 256GB SSD...,"€ 119,00","Nu in de aanbieding van € 139,00 voor € 119,00! L&o computers maakt de verkoop van gebruikte ex-lease producten moge",https://www.marktplaats.nl/v/computers-en-software/windows-laptops/a1509815863-hp-elitebook-820-g3-intel-core-i5-6200u-8gb-256gb-ssd,Vandaag,Gebruikt
HP Probook 445 G7 | AMD Ryzen 5 | 8 GB | 256SSD | Windows11,"€ 375,00","Hp probook 445 g7 refurbished in a+ conditie, nauwelijks tot geen gebruikerssporen processor: amd ryzen 5 4600 werkegeheugen: 8 gb",https://www.marktplaats.nl/v/computers-en-software/windows-laptops/a1505571337-hp-probook-445-g7-amd-ryzen-5-8-gb-256ssd-windows11,Vandaag,Refurbished
Lenovo TinkCentre SFF M720s i3-8100 8GB 256GB NVMe W11,"€ 129,00",Welkom bij pc magnaat! Graag bieden wij u het volgende aan: merk : lenovo model serie: thinkcentre model type: m720s formaat: midd,https://www.marktplaats.nl/v/computers-en-software/desktop-pc-s/a1509614818-lenovo-tinkcentre-sff-m720s-i3-8100-8gb-256gb-nvme-w11,Vandaag,Gebruikt
"2.5 en 3.5 Server SAS, SATA Harddisks HDD en SSD HP DELL",Zie omschrijving,"Zowel 2.5"" sff sas en sata schijven als 3.5"" lff harddisks voorradig. Ook ssd's hgst, samsung, seagate, hitachi, wes",https://www.marktplaats.nl/v/computers-en-software/harde-schijven/a1292034040-2-5-en-3-5-server-sas-sata-harddisks-hdd-en-ssd-hp-dell,Vandaag,Nieuw
Datascan - DS014010 fontUSB,"€ 200,00","Barcode fontmodule printers (voor accept giro) (ds014010) usb artikelnummer ds014010, geschikt voor de volgende printers: lj p3005",https://www.marktplaats.nl/v/computers-en-software/printerbenodigdheden/a1497304417-datascan-ds014010-fontusb,Vandaag,Zo goed als nieuw
Dell Optiplex 5080 i5 8GB DDR4 256GB NVMe Windows 11/10,"€ 399,00",Welkom bij pc magnaat! Graag bieden wij u het volgende aan: merk : dell model serie: optiplex model type: 5080 formaat: klein (tin,https://www.marktplaats.nl/v/computers-en-software/desktop-pc-s/a1509614843-dell-optiplex-5080-i5-8gb-ddr4-256gb-nvme-windows-11-10,Vandaag,Zo goed als nieuw
HP ProDesk 600 G4 DM i5-8500T 8GB DDR4 256GB NVMe,"€ 239,00",Welkom bij pc magnaat! Graag bieden wij u het volgende aan: merk : hp model serie: prodesk model type: 600 g4 formaat: klein (tiny,https://www.marktplaats.nl/v/computers-en-software/desktop-pc-s/a1509614821-hp-prodesk-600-g4-dm-i5-8500t-8gb-ddr4-256gb-nvme,Vandaag,Zo goed als nieuw
Refurbished HP ZBook 15 G6 met garantie,"€ 548,95","Hp zbook 15 g6 i7-9850h, 32gb ram/512gb ssd, 15.6"" fhd, wifi+bt+4g wwan, quadro t1000, w11p met minimaal 2 jaar garantie uitg",https://www.marktplaats.nl/v/computers-en-software/windows-laptops/a1502902900-refurbished-hp-zbook-15-g6-met-garantie,Vandaag,Gebruikt
HP ZBook FireFly 14 G7 | i7 | 32 Gb | 512 Gb SSD | Quadro,"€ 399,00",It bedrijf biedt aan: een zeer nette en complete hp zbook firefly 14 g7. De laptop is volledig gecontroleerd en voorzien van de la,https://www.marktplaats.nl/v/computers-en-software/windows-laptops/a1509782556-hp-zbook-firefly-14-g7-i7-32-gb-512-gb-ssd-quadro,18 jan 25,Refurbished
HP Probook 440 G5 Intel Core i5 8250U | 8GB | 256GB SSD |...,"€ 199,00","L&o computers maakt de verkoop van gebruikte ex-lease producten mogelijk door deze in de productieafdeling te controleren, tes",https://www.marktplaats.nl/v/computers-en-software/windows-laptops/a1508623317-hp-probook-440-g5-intel-core-i5-8250u-8gb-256gb-ssd,18 jan 25,Gebruikt
Dell OptiPlex 7060 Micro Core i5 8400 - SSD 512 GB RAM 16GB,"€ 329,99","Intel core | i5-8400t (max. 3.3 Ghz) 16gb ddr4 sdram werkgeheugen 512 ssd nmve opslagcapaciteit windows 11 pro 64bits 5x usb-3.2,",https://www.marktplaats.nl/v/computers-en-software/desktop-pc-s/a1486019163-dell-optiplex-7060-micro-core-i5-8400-ssd-512-gb-ram-16gb,Vandaag,Zo goed als nieuw
Dell Optiplex 3060 MFF i3-8100T 8GB 128GB NVMe windows 10/11,"€ 129,00",Welkom bij pc magnaat! Graag bieden wij u het volgende aan: merk : dell model serie: optiplex model type: 3060 formaat: klein (tin,https://www.marktplaats.nl/v/computers-en-software/desktop-pc-s/a1509614849-dell-optiplex-3060-mff-i3-8100t-8gb-128gb-nvme-windows-10-11,Vandaag,Zo goed als nieuw
HP ProDesk 400 G4 i5 8GB DDR4 256GB NVMe Windows 11/10,"€ 259,00",Welkom bij pc magnaat! Graag bieden wij u het volgende aan: merk : hp model serie: prodesk model type: 400 g4 formaat: klein (tiny,https://www.marktplaats.nl/v/computers-en-software/desktop-pc-s/a1509614858-hp-prodesk-400-g4-i5-8gb-ddr4-256gb-nvme-windows-11-10,Gisteren,Zo goed als nieuw
Lenovo ThinkCentre M70q i5 8GB DDR4 256GB NVMe Windows 11/10,"€ 379,00",Welkom bij pc magnaat! Graag bieden wij u het volgende aan: merk : lenovo model serie: thinkcentre model type: m70q formaat: klein,https://www.marktplaats.nl/v/computers-en-software/desktop-pc-s/a1509615028-lenovo-thinkcentre-m70q-i5-8gb-ddr4-256gb-nvme-windows-11-10,Gisteren,Zo goed als nieuw
HP ZBook 15 G3 | Core i7 / 32GB / 1TB SSD,"€ 449,00","Hp workstation zbook 15 g3 extreem sterke laptop, een echte desktopvervanger. Wordt geleverd met adapter en netsnoer. Voorzien van",https://www.marktplaats.nl/v/computers-en-software/windows-laptops/a1498036870-hp-zbook-15-g3-core-i7-32gb-1tb-ssd,18 jan 25,Gebruikt
HP ProBook 650 G2 - Azerty | Intel Core i5 | 8GB,"€ 165,00","Ontdek de hp probook 650 g2, een betrouwbare laptop met een 15,6"" full hd beeldscherm, ideaal voor zowel werk als entertainme",https://www.marktplaats.nl/v/computers-en-software/windows-laptops/a1508150204-hp-probook-650-g2-azerty-intel-core-i5-8gb,18 jan 25,Zo goed als nieuw
HP E232 B-Grade | Zonder standaard,"€ 39,00","Hp elitedisplay e232 let op: b-grade product, de monitor heeft bijvoorbeeld een kras op het display of een dode pixel. Amper te zi",https://www.marktplaats.nl/v/computers-en-software/monitoren/a1493756710-hp-e232-b-grade-zonder-standaard,Gisteren,Gebruikt
HP Elitebook 840 G8 | Core i5 / 16GB / 256GB SSD,"€ 415,00",Hp elitebook 840 g8 de hp elitebook 840 g8 is een zakelijke laptop die tot de hp elitebook-serie behoort. Voorzien van een 11e gen,https://www.marktplaats.nl/v/computers-en-software/windows-laptops/a1493589719-hp-elitebook-840-g8-core-i5-16gb-256gb-ssd,Gisteren,Gebruikt
Jetmobile - Jetmobile JM30100U barcode module,"€ 100,00",- nog op voorraad:37 jetmobile jm30100u barcode module geschikt voor: clj 3000(1) jm30100u clj 3800 jm30100u clj cm3530mfp jm30100,https://www.marktplaats.nl/v/computers-en-software/printerbenodigdheden/a1497304177-jetmobile-jetmobile-jm30100u-barcode-module,18 jan 25,Nieuw
HP Zbook Fury 16 G10 | Intel i7 | 64 GB | 1 TB | Nvidia 3500,"€ 2.250,00","Hp zbook fury 16 g10 refurbished a+ grade, kan een minimaal spoortje hebben. Vrijwel in nieuwstaat. Processor : intel i7 13700hx i",https://www.marktplaats.nl/v/computers-en-software/windows-laptops/a1509611621-hp-zbook-fury-16-g10-intel-i7-64-gb-1-tb-nvidia-3500,18 jan 25,Refurbished
Dell Optiplex 3080 MFF i5 8GB DDR4 256GB NVMe Windows10/11,"€ 329,00",Welkom bij pc magnaat! Graag bieden wij u het volgende aan: merk : dell model serie: optiplex model type: 3080 formaat: klein (tin,https://www.marktplaats.nl/v/computers-en-software/desktop-pc-s/a1509614917-dell-optiplex-3080-mff-i5-8gb-ddr4-256gb-nvme-windows10-11,Gisteren,Zo goed als nieuw
Refurbished HP Z840 Workstation 16core 128gb Quadro K5000,"€ 600,00","Ben je op zoek naar een krachtige workstation voor zware toepassingen zoals videobewerking, 3d-rendering of wetenschappelijke simu",https://www.marktplaats.nl/v/computers-en-software/desktop-pc-s/a1509322403-refurbished-hp-z840-workstation-16core-128gb-quadro-k5000,Gisteren,Refurbished
HP ProBook 450 G7 - i7 | Intel Core i7 | 8GB,"€ 395,00","Ontdek de hp probook 450 g7, een betrouwbare laptop met solide prestaties voor zowel werk als ontspanning. Deze 15,6-inch laptop b",https://www.marktplaats.nl/v/computers-en-software/windows-laptops/a1505439686-hp-probook-450-g7-i7-intel-core-i7-8gb,Vandaag,Gebruikt
Jetmobile - Jetmobile JM30100X barcode module,"€ 175,00",- nog op voorraad:7 jetmobile jm30100x barcode module geschikt voor: lj enterprise m506 jm30100x lj enterprise m507 jm30100x lj en,https://www.marktplaats.nl/v/computers-en-software/printerbenodigdheden/a1497304279-jetmobile-jetmobile-jm30100x-barcode-module,Vandaag,Nieuw
HP EliteBook 850 G5 i5-8350U 8GB 256GB SSD,"€ 200,00",Zo goed als nieuw hp elitebook - geen krassen of beschadigingen. Ideaal voor school / studie.werk en thuis. Spec: inter core i5-83,https://www.marktplaats.nl/v/computers-en-software/windows-laptops/m2226138047-hp-elitebook-850-g5-i5-8350u-8gb-256gb-ssd,Gisteren,Zo goed als nieuw
HP Elitebook 840 G5 Intel Core i7 8650U | 8GB | 256GB | F...,"€ 269,00","L&o computers maakt de verkoop van gebruikte ex-lease producten mogelijk door deze in de productieafdeling te controleren, tes",https://www.marktplaats.nl/v/computers-en-software/windows-laptops/a1508623320-hp-elitebook-840-g5-intel-core-i7-8650u-8gb-256gb-f,Gisteren,Gebruikt
HP Zbook Fury 15 G7 | Intel i7 | 32 GB | Nvidia RTX3000,"€ 999,00","Refurbished a grade, enkele minimale gebruikerssporen op de behuizing wij hebben dit model in onze webshop ook met rtx5000 16gb vi",https://www.marktplaats.nl/v/computers-en-software/windows-laptops/a1506004972-hp-zbook-fury-15-g7-intel-i7-32-gb-nvidia-rtx3000,Gisteren,Refurbished
HP ProDesk 600 G5 DM i3 8GB DDR4 256GB NVMe Windows 11/10,"€ 169,00",Welkom bij pc magnaat! Graag bieden wij u het volgende aan: merk : hp model serie: prodesk model type: 600 g5 formaat: klein (tiny,https://www.marktplaats.nl/v/computers-en-software/desktop-pc-s/a1509614894-hp-prodesk-600-g5-dm-i3-8gb-ddr4-256gb-nvme-windows-11-10,Gisteren,Zo goed als nieuw
HP Z440 Workstation | XEON / 16GB ram / 256GB SSD,"€ 179,00","Hp z440 workstation zeer krachtige tower pc, voorzien van een intel xeon processor en 256gb ssd deze pc beschikt over een quadro k",https://www.marktplaats.nl/v/computers-en-software/desktop-pc-s/a1497307768-hp-z440-workstation-xeon-16gb-ram-256gb-ssd,Gisteren,Gebruikt
HP ProBook 450 G9 - Core i5-1235U / 8GB / 256GB NVMe SSD,"€ 499,99","Hp probook 450 g9 intel core | i5-1235u (max. 4.4 Ghz) 15.6 Inch full hd ips led, resolutie 1920x1080 8gb ddr4 sdram werkgeheugen",https://www.marktplaats.nl/v/computers-en-software/windows-laptops/a1509386255-hp-probook-450-g9-core-i5-1235u-8gb-256gb-nvme-ssd,Gisteren,Zo goed als nieuw
Refurbished HP EliteDesk 800 G2 TWR (MT) -Intel Core i5 6500,"€ 85,00",Ben je op zoek naar een krachtige en betrouwbare desktop voor je dagelijkse taken? De refurbished hp elitedesk 800 g2 twr (mt) is,https://www.marktplaats.nl/v/computers-en-software/desktop-pc-s/a1509323718-refurbished-hp-elitedesk-800-g2-twr-mt-intel-core-i5-6500,Gisteren,Refurbished
Refurbished HP EliteDesk 800 G4 SFF met garantie,"€ 258,95","Hp elitedesk 800 g4 sff i5-8500 6-core, 16gb ddr4/256gb ssd, dvdrw, usb-c, 2x dp, win 11 pro met minimaal 2 jaar garantie een mode",https://www.marktplaats.nl/v/computers-en-software/desktop-pc-s/a1508864239-refurbished-hp-elitedesk-800-g4-sff-met-garantie,Gisteren,Zo goed als nieuw
HP Envy Laptop 13-ah0120nd | Intel Core i5 | 8GB,"€ 250,00","De hp envy laptop 13-ah0120nd is een stijlvolle en krachtige laptop, ideaal voor zowel werk als ontspanning. Met een 13,3-inch ful",https://www.marktplaats.nl/v/computers-en-software/windows-laptops/a1506325192-hp-envy-laptop-13-ah0120nd-intel-core-i5-8gb,Gisteren,Gebruikt
Refurbished HP EliteDesk 800 G5 SFF met garantie,"€ 289,95","Hp elitedesk 800 g5 sff i5-9500 6-core, 16gb ddr4/256gb ssd, dvdrw, 2x usb-c, 2x dp, win 11 pro met minimaal 2 jaar garantie een m",https://www.marktplaats.nl/v/computers-en-software/desktop-pc-s/a1509153627-refurbished-hp-elitedesk-800-g5-sff-met-garantie,Gisteren,Gebruikt
Refurbished HP EliteDesk 800 G5 SFF met garantie,"€ 298,95","Hp elitedesk 800 g5 sff i5-9500 6-core, 16gb ddr4/256gb ssd, dvdrw, usb-c, 2x dp, win 11 pro met minimaal 2 jaar garantie een mode",https://www.marktplaats.nl/v/computers-en-software/desktop-pc-s/a1508864238-refurbished-hp-elitedesk-800-g5-sff-met-garantie,Vandaag,Zo goed als nieuw
HP Zbook 17 G5 Intel Core i7 8750H | 16GB | 256GB | AMD R...,"€ 499,00","L&o computers maakt de verkoop van gebruikte ex-lease producten mogelijk door deze in de productieafdeling te controleren, tes",https://www.marktplaats.nl/v/computers-en-software/windows-laptops/a1509185867-hp-zbook-17-g5-intel-core-i7-8750h-16gb-256gb-amd-r,Vandaag,Gebruikt
Refurbished HP EliteDesk 800 G5 SFF met garantie,"€ 274,95","Hp elitedesk 800 g5 sff i5-9500 6-core, 16gb ddr4/256gb ssd, dvdrw, usb-c, 2x dp, win 11 pro met minimaal 2 jaar garantie een mode",https://www.marktplaats.nl/v/computers-en-software/desktop-pc-s/a1508908376-refurbished-hp-elitedesk-800-g5-sff-met-garantie,Gisteren,Gebruikt
Refurbished HP EliteDesk 800 G5 SFF met garantie,"€ 279,95","Hp elitedesk 800 g5 sff core i5-9500 6-core, 16gb ddr4/256gb ssd, 2x usb-c, 2x dp, win 11 pro met minimaal 2 jaar garantie een mod",https://www.marktplaats.nl/v/computers-en-software/desktop-pc-s/a1509153622-refurbished-hp-elitedesk-800-g5-sff-met-garantie,Gisteren,Gebruikt
Refurbished HP EliteDesk 800 G5 SFF met garantie,"€ 294,95","Hp elitedesk 800 g5 sff core i5-9500 6-core, 16gb ddr4/256gb ssd, 2x usb-c, 2x dp, win 11 pro met minimaal 2 jaar garantie een mod",https://www.marktplaats.nl/v/computers-en-software/desktop-pc-s/a1509153624-refurbished-hp-elitedesk-800-g5-sff-met-garantie,Gisteren,Gebruikt
HP Probook 430 G6 Intel Core i5 8265U | 8GB DDR4 | 256GB...,"€ 219,00","L&o computers maakt de verkoop van gebruikte ex-lease producten mogelijk door deze in de productieafdeling te controleren, tes",https://www.marktplaats.nl/v/computers-en-software/windows-laptops/a1508507576-hp-probook-430-g6-intel-core-i5-8265u-8gb-ddr4-256gb,Gisteren,Zo goed als nieuw
HP Compaq Acer Toshiba Dell Asus Sony Adapter oplader (TIP),"€ 14,99","Viadennis levert deze nieuwe replacement adapters, accu's en toetsenborden. Adapters al vanaf 15 euro met 12 maanden volledige",https://www.marktplaats.nl/v/computers-en-software/laptop-opladers/a1001544287-hp-compaq-acer-toshiba-dell-asus-sony-adapter-oplader-tip,Gisteren,Nieuw
HP Probook 440 G4 Intel Core i3 7100U | 8GB | 128GB SSD |...,"€ 129,00","L&o computers maakt de verkoop van gebruikte ex-lease producten mogelijk door deze in de productieafdeling te controleren, tes",https://www.marktplaats.nl/v/computers-en-software/windows-laptops/a1508248835-hp-probook-440-g4-intel-core-i3-7100u-8gb-128gb-ssd,Gisteren,Zo goed als nieuw
HP EliteDesk 800 G8 mini | Core i5 / 16GB / 256GB SSD,"€ 537,00",Hp elitedesk 800 g8 mini zeer kleine en snelle pc met 11e generatie intel core i5 processor. Windows 11 compatible. Wordt geleverd,https://www.marktplaats.nl/v/computers-en-software/desktop-pc-s/a1508753349-hp-elitedesk-800-g8-mini-core-i5-16gb-256gb-ssd,Vandaag,Gebruikt
HP Prodesk 600 G2 SFF Intel i5 6600 | 8GB | 256GB SSD | D...,"€ 129,00","L&o computers maakt de verkoop van gebruikte ex-lease producten mogelijk door deze in de productieafdeling te controleren, tes",https://www.marktplaats.nl/v/computers-en-software/desktop-pc-s/a1509036812-hp-prodesk-600-g2-sff-intel-i5-6600-8gb-256gb-ssd-d,Vandaag,Zo goed als nieuw
HP t5740e Thin Client| 4GB SSD| 4GB DDR3| Win7E,"€ 19,95","Hp t5740e thin client processor: intel atom n280 1,66ghz geheugen: 4gb ddr3 opslag: 4gb ssd flash videokaart: intel mobile gl40 ve",https://www.marktplaats.nl/v/computers-en-software/desktop-pc-s/a1480920979-hp-t5740e-thin-client-4gb-ssd-4gb-ddr3-win7e,19 jan 25,Zo goed als nieuw
HP t520 ThinClient| AMD GX-212JC| 16GB SSD| 4GB DDR3| Win8,"€ 45,99",Specificaties: processor: amd gx-212jc 1.2Ghz geheugen: 4gb ddr3l opslag: 16gb ssd videokaart: amd radeon hd graphics verbinding (,https://www.marktplaats.nl/v/computers-en-software/desktop-pc-s/a1481767020-hp-t520-thinclient-amd-gx-212jc-16gb-ssd-4gb-ddr3-win8,19 jan 25,Zo goed als nieuw
BASIC Game PC HP i5 NVIDIA GT1030 2GB - Windows 11,"€ 329,00",Refurbished game pc van alpha-shop: de refurbished basic game pc is door ons samengesteld om jou te voorzien van een zeer voordeli,https://www.marktplaats.nl/v/computers-en-software/desktop-pc-s/a1507378440-basic-game-pc-hp-i5-nvidia-gt1030-2gb-windows-11,Gisteren,Nieuw
HP ProBook 450 G3 | Intel Core i5 | 8GB,"€ 165,00","Ontdek de hp probook 450 g3, een stijlvolle laptop met een snelle i5-processor en een mooi ontwerp. Deze laptop combineert essenti",https://www.marktplaats.nl/v/computers-en-software/windows-laptops/a1496079891-hp-probook-450-g3-intel-core-i5-8gb,Gisteren,Gebruikt
HP ProBook 430 G7 | Intel Core i5 | 8GB,"€ 255,00","Ontdek de hp probook 430 g7, een compacte en krachtige laptop met een 13,3"" full hd beeldscherm, ideaal voor zowel werk als o",https://www.marktplaats.nl/v/computers-en-software/windows-laptops/a1504018499-hp-probook-430-g7-intel-core-i5-8gb,Vandaag,Gebruikt
HP ProBook 650 G3 - Azerty | Intel Core i5 | 8GB,"€ 180,00","Ontdek de hp probook 650 g3, een betrouwbare laptop met een 15,6"" full hd beeldscherm, ideaal voor zowel werk als entertainme",https://www.marktplaats.nl/v/computers-en-software/windows-laptops/a1504018502-hp-probook-650-g3-azerty-intel-core-i5-8gb,Vandaag,Zo goed als nieuw
HP ProDesk 600 G5 DM i3 8GB DDR4 256GB NVMe Windows 11/10,"€ 169,00",Welkom bij pc magnaat! Graag bieden wij u het volgende aan: merk : hp model serie: prodesk model type: 600 g5 formaat: klein (tiny,https://www.marktplaats.nl/v/computers-en-software/desktop-pc-s/a1509614894-hp-prodesk-600-g5-dm-i3-8gb-ddr4-256gb-nvme-windows-11-10,Vandaag,Zo goed als nieuw
HP Z Display Z30i Monitor 30 inch Breedbeeld 2K Resolutie...,"€ 125,00","Nu in de aanbieding van € 149,00 voor € 125,00! L&o computers maakt de verkoop van gebruikte ex-lease producten moge",https://www.marktplaats.nl/v/computers-en-software/monitoren/a1506777350-hp-z-display-z30i-monitor-30-inch-breedbeeld-2k-resolutie,Vandaag,Zo goed als nieuw
Refurbished HP 2013 UltraSlim Docking Station met garantie,"€ 34,95","Hp 2013 ultraslim docking station incl. 65W adapter (2x displayport, 1x vga, 4x usb, p/n d9y32aa) met minimaal 2 jaar garantie gel",https://www.marktplaats.nl/v/computers-en-software/dockingstations/a1500717966-refurbished-hp-2013-ultraslim-docking-station-met-garantie,Vandaag,Zo goed als nieuw
HP Workstation Z620 | 128 GB RAM / SSD+ HDD / Quadro,"€ 266,00",Hp workstation z620 e5-2620 / 128 gb / hdd+ ssd/ quadro hp workstation z620 met 128 gb geheugen wordt geleverd met windows en klaa,https://www.marktplaats.nl/v/computers-en-software/desktop-pc-s/a1190681052-hp-workstation-z620-128-gb-ram-ssd-hdd-quadro,Vandaag,Zo goed als nieuw
HP Zbook Studio 16 G9 | Intel i7 | 1 TB SSD | 32 GB | NVIDIA,"€ 2.499,00",Hp zbook studio 16 g9. Nieuwe modellen. Dozen zijn eerder opengemaakt maar de laptop's zijn niet in gebruik genomen en nog spl,https://www.marktplaats.nl/v/computers-en-software/windows-laptops/a1506764610-hp-zbook-studio-16-g9-intel-i7-1-tb-ssd-32-gb-nvidia,Vandaag,Nieuw
HP - LJ P3005 N (Q7814A),"€ 100,00",The hp laserjet p3005n a sleek laser printer ideal with an integrated print server allows your new printer to effectively communic,https://www.marktplaats.nl/v/computers-en-software/printers/a1504345507-hp-lj-p3005-n-q7814a,Vandaag,Zo goed als nieuw
HP - LJ P4015 N (CB509A),"€ 200,00","Hp p4015 serie kan documenten van hoge kwaliteit produceren met 1200 dpi. Deze machine is een snelle, betrouwbare zwart-wit laserp",https://www.marktplaats.nl/v/computers-en-software/printers/a1501002933-hp-lj-p4015-n-cb509a,Vandaag,Zo goed als nieuw
HP - CLJ CM4540 MFP (CC419A),"€ 595,00","Werkgroepen kunnen gemakkelijk printen, kopiëren, scannen, digitaal zenden en faxen[5] met deze handige kleuren-mfp serie. Briljan",https://www.marktplaats.nl/v/computers-en-software/printers/a1507695690-hp-clj-cm4540-mfp-cc419a,Eergisteren,Zo goed als nieuw
HP - LJ P4015 TN (CB510A),"€ 275,00",Lj p4015 tn (cb510a) tcop bv(second hand hp) weerschip 10 3991 cr houten tel.: 030-2288022 Fax.: 030-2250842 Bezichtiging en afhaa,https://www.marktplaats.nl/v/computers-en-software/printers/a1507695691-hp-lj-p4015-tn-cb510a,Gisteren,Zo goed als nieuw
HP - Designjet T2600 Dual roll 36 inch postscript mfp,"€ 5.995,00",Designjet t2600 dual roll 36 inch postscript mfp (3ek15a) hp designjet t2600 mfp dr ps 36 inch – (3ek15a) ontwikkeld met het oog o,https://www.marktplaats.nl/v/computers-en-software/printers/a1508764597-hp-designjet-t2600-dual-roll-36-inch-postscript-mfp,19 jan 25,Zo goed als nieuw
HP - lj enterprise m607dn (k0q15a),"€ 695,00",Lj enterprise m607dn (k0q15a) plus & minpunten: * 52 ppm * netwerkaansluiting * usb aansluiting * dubbelzijdig printen tcop bv,https://www.marktplaats.nl/v/computers-en-software/printers/a1509108252-hp-lj-enterprise-m607dn-k0q15a,19 jan 25,Zo goed als nieuw
HP - lj enterprise m609dn (k0q21a),"€ 695,00",Lj enterprise m609dn (k0q21a) plus & minpunten: * 71 ppm * netwerkaansluiting * usb aansluiting * dubbelzijdig printen - extra,https://www.marktplaats.nl/v/computers-en-software/printers/a1506067951-hp-lj-enterprise-m609dn-k0q21a,Eergisteren,Zo goed als nieuw
HP - Enterprise MFP M725f (CF067A),"€ 895,00","Enterprise mfp m725f (cf067a) - zeer uitgebreide zwart-wit multifuntional. - Printen, kopieren, scannen tot a3) formaat - scan to",https://www.marktplaats.nl/v/computers-en-software/printers/a1497304395-hp-enterprise-mfp-m725f-cf067a,Gisteren,Zo goed als nieuw
HP - LJ Enterprise M4555 FSKM (CE504A),"€ 695,00",Kenmerken deze veelzijdige mfp is productief en levert betrouwbare prestaties. U blijft productief dankzij hoge snelheden: printen,https://www.marktplaats.nl/v/computers-en-software/printers/a1497304287-hp-lj-enterprise-m4555-fskm-ce504a,Eergisteren,Zo goed als nieuw
