Title,Price,Description,Link,Date,Usage
HP - ac usb proximity reader (cz208a),"€ 75,00",Ac usb proximity reader (cz208a) productinformatiehp access control usb proximity reader overzicht van de oplossing bescherm de ve,https://www.marktplaats.nl/v/computers-en-software/printerbenodigdheden/a1497304248-hp-ac-usb-proximity-reader-cz208a,19 jan 25,Zo goed als nieuw
HP - 2.000vel papierlade en standaard (y1f99a),"€ 795,00",2.000Vel papierlade en standaard (y1f99a) tcop bv(second hand hp) weerschip 10 3991 cr houten tel.: 030-2288022 Fax.: 030-2250842,https://www.marktplaats.nl/v/computers-en-software/printerbenodigdheden/a1497304317-hp-2-000vel-papierlade-en-standaard-y1f99a,19 jan 25,Nieuw
HP - 2x520sh Dept PaperTray/Stand E877 series (6GW47A),"€ 495,00",Geschikt voor de nieuwe e877 e826 series van hp plus & minpunten: * 2 x 500 vel lade met onderstel tcop bv(second hand hp) wee,https://www.marktplaats.nl/v/computers-en-software/printerbenodigdheden/a1497304372-hp-2x520sh-dept-papertray-stand-e877-series-6gw47a,19 jan 25,Zo goed als nieuw
HP - q5691a (finisher for 4345 (q5691a),"€ 145,00",Q5691a (finisher for 4345 (q5691a) tcop bv(second hand hp) weerschip 10 3991 cr houten tel.: 030-2288022 Fax.: 030-2250842 Bezicht,https://www.marktplaats.nl/v/computers-en-software/printerbenodigdheden/a1497304190-hp-q5691a-finisher-for-4345-q5691a,Vandaag,Zo goed als nieuw
"HP - stapler stacker finisher e725, e778, e825, e876","€ 995,00","Stapler stacker finisher e725, e778, e825, e876 (y1g18a) tcop bv(second hand hp) weerschip 10 3991 cr houten tel.: 030-2288022 Fax",https://www.marktplaats.nl/v/computers-en-software/printerbenodigdheden/a1509108251-hp-stapler-stacker-finisher-e725-e778-e825-e876,19 jan 25,Nieuw
HP 58,"€ 25,00","Hp 58. Type kleureninkt: pigmentgebaseerde inkt, inkjet cartridge type: normaal rendement, type zwarte inkt: pigmentgebaseerde ink",https://www.marktplaats.nl/v/computers-en-software/printerbenodigdheden/m2225898765-hp-58,Gisteren,Zo goed als nieuw
"HP - lj interne finisher e825, e876 (y1g00a)","€ 395,00","Lj interne finisher e825, e876 (y1g00a) tcop bv(second hand hp) weerschip 10 3991 cr houten tel.: 030-2288022 Fax.: 030-2250842 Be",https://www.marktplaats.nl/v/computers-en-software/printerbenodigdheden/a1509108244-hp-lj-interne-finisher-e825-e876-y1g00a,Gisteren,Zo goed als nieuw
HP t5740e Thin Client| 4GB SSD| 4GB DDR3| Win7E,"€ 19,95","Hp t5740e thin client processor: intel atom n280 1,66ghz geheugen: 4gb ddr3 opslag: 4gb ssd flash videokaart: intel mobile gl40 ve",https://www.marktplaats.nl/v/computers-en-software/desktop-pc-s/a1480920979-hp-t5740e-thin-client-4gb-ssd-4gb-ddr3-win7e,19 jan 25,Zo goed als nieuw
HP - HP LaserJet 500-Sheet Paper Tray (CZ261A),"€ 225,00",- nog op voorraad:3 hp laserjet 500-sheet paper tray (cz261a) tcop bv(second hand hp) weerschip 10 3991 cr houten tel.: 030-228802,https://www.marktplaats.nl/v/computers-en-software/printerbenodigdheden/a1497304271-hp-hp-laserjet-500-sheet-paper-tray-cz261a,Vandaag,Nieuw
HP - HP LaserJet papierinvoer/lade voor 500 vel (CF284A),"€ 50,00",- nog op voorraad:50 hp laserjet papierinvoer/lade voor 500 vel (cf284a) voor m401 serie tcop bv(second hand hp) weerschip 10 3991,https://www.marktplaats.nl/v/computers-en-software/printerbenodigdheden/a1497304156-hp-hp-laserjet-papierinvoer-lade-voor-500-vel-cf284a,16 jan 25,Nieuw
HP - 900-sheet 3-bin stapling mailbox (b3m76a),"€ 250,00",900-sheet 3-bin stapling mailbox (b3m76a) tcop bv(second hand hp) weerschip 10 3991 cr houten tel.: 030-2288022 Fax.: 030-2250842,https://www.marktplaats.nl/v/computers-en-software/printerbenodigdheden/a1499196390-hp-900-sheet-3-bin-stapling-mailbox-b3m76a,19 jan 25,Nieuw
HP - Lade HP2015 (q5931a),"€ 35,00",- nog op voorraad:16 lade hp2015 (q5931a) tcop bv(second hand hp) weerschip 10 3991 cr houten tel.: 030-2288022 Fax.: 030-2250842,https://www.marktplaats.nl/v/computers-en-software/printerbenodigdheden/a1497304173-hp-lade-hp2015-q5931a,19 jan 25,Nieuw
A4 Zwart Wit Laser Printer All In One Garantie HP M527dn MFP,"€ 349,00","Refurbised a4 all in one zwart/wit laser vanaf € 349,- incl. Garantie, excl. Btw (nieuwprijs vanaf € 1.399,- Excl. Btw)",https://www.marktplaats.nl/v/computers-en-software/printers/a1292674128-a4-zwart-wit-laser-printer-all-in-one-garantie-hp-m527dn-mfp,18 jan 25,Zo goed als nieuw
Zebra - ZT610 (ZT61043-T0E0100Z),"€ 1.295,00",Zt610 (zt61043-t0e0100z) zebra zt610 (zt61043-t0e0100z): krachtige en nauwkeurige industriële labelprinter de zebra zt610 is de pe,https://www.marktplaats.nl/v/computers-en-software/printers/a1506825838-zebra-zt610-zt61043-t0e0100z,Eergisteren,Zo goed als nieuw
Onbekend - TTP-346 pro,"€ 695,00","Ttp-346 pro tsc ttp-344m pro, 12 dots/mm (300 dpi), rtc, display, tspl-ez, usb, rs232, lpt, ethernet - 99-047a003-d0lf - label pri",https://www.marktplaats.nl/v/computers-en-software/printers/a1497304146-onbekend-ttp-346-pro,Eergisteren,Zo goed als nieuw
HP Degelijk USB Toetsenbord,"€ 20,00","Dit degelijk hp toetsenbord verkeert in zeer goede staat. Usb-kabel, 2 verstelbare voetjes aan de onderkant , de ku-1156 is ontwor",https://www.marktplaats.nl/v/computers-en-software/toetsenborden/m2226021256-hp-degelijk-usb-toetsenbord,Gisteren,Zo goed als nieuw
Zebra - ZT410 (ZT41042-T1E0000Z),"€ 695,00",Zt41042-t1e0000z zebra zt410 (zt41042-t1e0000z): de perfecte barcodeprinter voor professioneel gebruik de zebra zt410 is een betro,https://www.marktplaats.nl/v/computers-en-software/printers/a1507834408-zebra-zt410-zt41042-t1e0000z,Gisteren,Zo goed als nieuw
HP - LaserJet Stapler/Stackerfor M806 / M830 (CZ994A),"€ 1.995,00",Compatibel producten: hp laserjet enterprise m806x+ nfc/wireless direct printer (d7p69a) hp laserjet enterprise m806dn printer (cz,https://www.marktplaats.nl/v/computers-en-software/printerbenodigdheden/a1497304392-hp-laserjet-stapler-stackerfor-m806-m830-cz994a,18 jan 25,Nieuw
HP Probook 650 G5 Intel Core i5 8265U | 8GB | 256GB SSD |...,"€ 239,00","Nu in de aanbieding van € 299,00 voor € 239,00! L&o computers maakt de verkoop van gebruikte ex-lease producten moge",https://www.marktplaats.nl/v/computers-en-software/windows-laptops/a1508507582-hp-probook-650-g5-intel-core-i5-8265u-8gb-256gb-ssd,Gisteren,Gebruikt
HP - HP High-Performance Secure EIO Hard Disk (J8019A),"€ 150,00",Hp high-performance secure eio hard disk (j8019a) tcop bv(second hand hp) weerschip 10 3991 cr houten tel.: 030-2288022 Fax.: 030-,https://www.marktplaats.nl/v/computers-en-software/printerbenodigdheden/a1497304255-hp-hp-high-performance-secure-eio-hard-disk-j8019a,Gisteren,Zo goed als nieuw
Dell HP SuperMicro IBM servers direct leverbaar met garantie,Op aanvraag,Diverse merken en modellen refurbished servers en server onderdelen direct uit voorraad leverbaar. Staat hetgeen u zoekt niet in h,https://www.marktplaats.nl/v/computers-en-software/servers/a1290691562-dell-hp-supermicro-ibm-servers-direct-leverbaar-met-garantie,Gisteren,Zo goed als nieuw
Dell Optiplex 5080 i5 8GB DDR4 256GB NVMe Windows 11/10,"€ 399,00",Welkom bij pc magnaat! Graag bieden wij u het volgende aan: merk : dell model serie: optiplex model type: 5080 formaat: klein (tin,https://www.marktplaats.nl/v/computers-en-software/desktop-pc-s/a1509614843-dell-optiplex-5080-i5-8gb-ddr4-256gb-nvme-windows-11-10,Gisteren,Zo goed als nieuw
Refurbished HP ZBook 15 G6 met garantie,"€ 548,95","Hp zbook 15 g6 i7-9850h, 32gb ram/512gb ssd, 15.6"" fhd, wifi+bt+4g wwan, quadro t1000, w11p met minimaal 2 jaar garantie uitg",https://www.marktplaats.nl/v/computers-en-software/windows-laptops/a1502902900-refurbished-hp-zbook-15-g6-met-garantie,Gisteren,Gebruikt
"HP - Booklet Maker/Finisher (CZ285A) for M806, M830","€ 1.495,00","Booklet maker/finisher (cz285a) for m806, m830 tcop bv(second hand hp) weerschip 10 3991 cr houten tel.: 030-2288022 Fax.: 030-225",https://www.marktplaats.nl/v/computers-en-software/printerbenodigdheden/a1497304360-hp-booklet-maker-finisher-cz285a-for-m806-m830,Gisteren,Zo goed als nieuw
HP ProDesk 600 G4 Desktop Mini PC,"€ 150,00",Betrouwbaarheid en prestaties voor de toekomst de stijlvolle en ultrakleine hp prodesk 600 desktop mini is ontworpen voor de moder,https://www.marktplaats.nl/v/computers-en-software/desktop-pc-s/m2225889567-hp-prodesk-600-g4-desktop-mini-pc,Gisteren,Gebruikt
HP - finisher booklet maker - 3000 sheets - (Y1G07A),"€ 695,00","Finisher booklet maker - 3000 sheets - (y1g07a) make your documents look polished. The hp laserjet booklet finisher adds folding,",https://www.marktplaats.nl/v/computers-en-software/printerbenodigdheden/a1506908273-hp-finisher-booklet-maker-3000-sheets-y1g07a,Gisteren,Nieuw
HP DL360 G9 / E5-2699v3 2.3GHz 18 Core / 128GB DDR4,"€ 512,00",Creoserver.com is een ervaren specialist in maatwerk van hardware. We bieden hp servers gegarandeerd in top refurbished conditie.,https://www.marktplaats.nl/v/computers-en-software/servers/a1312163653-hp-dl360-g9-e5-2699v3-2-3ghz-18-core-128gb-ddr4,Gisteren,Refurbished
HP - pagewide enterprise cabinet and stand (g1w44a),"€ 195,00",Pagewide enterprise cabinet and stand (g1w44a) tcop bv(second hand hp) weerschip 10 3991 cr houten tel.: 030-2288022 Fax.: 030-225,https://www.marktplaats.nl/v/computers-en-software/printerbenodigdheden/a1497304264-hp-pagewide-enterprise-cabinet-and-stand-g1w44a,18 jan 25,Zo goed als nieuw
HP - 3x550-sheet feeder and stand (p1b11a),"€ 695,00","3x550-sheet feeder and stand (p1b11a) geschikt voor: hp color laserjet enterprise m652n j7z98a, hp color laserjet enterprise m652d",https://www.marktplaats.nl/v/computers-en-software/printerbenodigdheden/a1497304219-hp-3x550-sheet-feeder-and-stand-p1b11a,Eergisteren,Zo goed als nieuw
HP - printer stand (for 4250/4350 (q2445b),"€ 60,00",Printer stand (for 4250/4350 (q2445b) tcop bv(second hand hp) weerschip 10 3991 cr houten tel.: 030-2288022 Fax.: 030-2250842 Bezi,https://www.marktplaats.nl/v/computers-en-software/printerbenodigdheden/a1497304205-hp-printer-stand-for-4250-4350-q2445b,17 jan 25,Zo goed als nieuw
HP - stapler/stacker finisher 3 x 5000 nietjes (y1g14a),"€ 179,00",Stapler/stacker finisher 3 x 5000 nietjes (y1g14a) tcop bv(second hand hp) weerschip 10 3991 cr houten tel.: 030-2288022 Fax.: 030,https://www.marktplaats.nl/v/computers-en-software/printerbenodigdheden/a1497304340-hp-stapler-stacker-finisher-3-x-5000-nietjes-y1g14a,Eergisteren,Nieuw
"HP - printer cabinet - e725, e778 (y1g17a)","€ 495,00","Printer cabinet - e725, e778 (y1g17a) geschikt voor:hp e77822dn, e77822z, e77825dn, e77825z, e77830dn, e77830z, e72425dn, e72430dn",https://www.marktplaats.nl/v/computers-en-software/printerbenodigdheden/a1497304235-hp-printer-cabinet-e725-e778-y1g17a,Gisteren,Nieuw
HP t520 ThinClient| AMD GX-212JC| 16GB SSD| 4GB DDR3| Win8,"€ 45,99",Specificaties: processor: amd gx-212jc 1.2Ghz geheugen: 4gb ddr3l opslag: 16gb ssd videokaart: amd radeon hd graphics verbinding (,https://www.marktplaats.nl/v/computers-en-software/desktop-pc-s/a1481767020-hp-t520-thinclient-amd-gx-212jc-16gb-ssd-4gb-ddr3-win8,Gisteren,Zo goed als nieuw
HP - onderstel 3 x 500 cm6030-6040 (r95-3072),"€ 150,00",Onderstel 3 x 500 cm6030-6040 (r95-3072) tcop bv(second hand hp) weerschip 10 3991 cr houten tel.: 030-2288022 Fax.: 030-2250842 B,https://www.marktplaats.nl/v/computers-en-software/printerbenodigdheden/a1497304204-hp-onderstel-3-x-500-cm6030-6040-r95-3072,18 jan 25,Zo goed als nieuw
HP - tray for 4345 / m4345 (q5968a),"€ 75,00",Tray for 4345 / m4345 (q5968a) tcop bv(second hand hp) weerschip 10 3991 cr houten tel.: 030-2288022 Fax.: 030-2250842 Bezichtigin,https://www.marktplaats.nl/v/computers-en-software/printerbenodigdheden/a1497304192-hp-tray-for-4345-m4345-q5968a,19 jan 25,Zo goed als nieuw
De goedkoopste inkt cartridges en toners voor uw printer.!,"€ 0,69",Pas op! Voor aanbieders die inkt cartridges zeer goedkoop aanbieden. Het verschil zit in de inhoud en vooral de kwaliteit inkt die,https://www.marktplaats.nl/v/computers-en-software/printers/a1000935603-de-goedkoopste-inkt-cartridges-en-toners-voor-uw-printer,19 jan 25,Nieuw
HP - Extra papierlade Enterprise M600 series (CE998A),"€ 65,00","Hp laserjet papierladen voor 500 vel bevorderen de productiviteit van groeiende werkgroepen met een eenvoudig, robuuste invoeracce",https://www.marktplaats.nl/v/computers-en-software/printerbenodigdheden/a1497304182-hp-extra-papierlade-enterprise-m600-series-ce998a,19 jan 25,Zo goed als nieuw
HP - pagewide enterprise cabinet and stand (g1w44a),"€ 395,00",Pagewide enterprise cabinet and stand (g1w44a) tcop bv(second hand hp) weerschip 10 3991 cr houten tel.: 030-2288022 Fax.: 030-225,https://www.marktplaats.nl/v/computers-en-software/printerbenodigdheden/a1497304282-hp-pagewide-enterprise-cabinet-and-stand-g1w44a,19 jan 25,Nieuw
HP - 2x2000 sheet papertray and stand (p1v19a),"€ 995,00",2x2000 sheet papertray and stand (p1v19a) tcop bv(second hand hp) weerschip 10 3991 cr houten tel.: 030-2288022 Fax.: 030-2250842,https://www.marktplaats.nl/v/computers-en-software/printerbenodigdheden/a1497304231-hp-2x2000-sheet-papertray-and-stand-p1v19a,19 jan 25,Nieuw
HP Prodesk 600 G1 Mini Intel i5 4590T | 8GB | 128GB SSD |...,"€ 109,00","L&o computers maakt de verkoop van gebruikte ex-lease producten mogelijk door deze in de productieafdeling te controleren, tes",https://www.marktplaats.nl/v/computers-en-software/desktop-pc-s/a1508549192-hp-prodesk-600-g1-mini-intel-i5-4590t-8gb-128gb-ssd,Gisteren,Zo goed als nieuw
HP - HP High-Performance Secure EIO Hard Disk (J8019A),"€ 150,00",Hp high-performance secure eio hard disk (j8019a) tcop bv(second hand hp) weerschip 10 3991 cr houten tel.: 030-2288022 Fax.: 030-,https://www.marktplaats.nl/v/computers-en-software/printerbenodigdheden/a1497304255-hp-hp-high-performance-secure-eio-hard-disk-j8019a,Gisteren,Zo goed als nieuw
HP ProDesk 600 G4 DM i5-8500T 8GB DDR4 256GB NVMe,"€ 239,00",Welkom bij pc magnaat! Graag bieden wij u het volgende aan: merk : hp model serie: prodesk model type: 600 g4 formaat: klein (tiny,https://www.marktplaats.nl/v/computers-en-software/desktop-pc-s/a1509614821-hp-prodesk-600-g4-dm-i5-8500t-8gb-ddr4-256gb-nvme,Gisteren,Zo goed als nieuw
HP ZBook FireFly 14 G7 | i7 | 32 Gb | 512 Gb SSD | Quadro,"€ 399,00",It bedrijf biedt aan: een zeer nette en complete hp zbook firefly 14 g7. De laptop is volledig gecontroleerd en voorzien van de la,https://www.marktplaats.nl/v/computers-en-software/windows-laptops/a1509782556-hp-zbook-firefly-14-g7-i7-32-gb-512-gb-ssd-quadro,Gisteren,Refurbished
Dell OptiPlex 7060 Micro Core i5 8400 - SSD 512 GB RAM 16GB,"€ 329,99","Intel core | i5-8400t (max. 3.3 Ghz) 16gb ddr4 sdram werkgeheugen 512 ssd nmve opslagcapaciteit windows 11 pro 64bits 5x usb-3.2,",https://www.marktplaats.nl/v/computers-en-software/desktop-pc-s/a1486019163-dell-optiplex-7060-micro-core-i5-8400-ssd-512-gb-ram-16gb,Gisteren,Zo goed als nieuw
HP Z440 Workstation | XEON / 16GB ram / 256GB SSD,"€ 179,00","Hp z440 workstation zeer krachtige tower pc, voorzien van een intel xeon processor en 256gb ssd deze pc beschikt over een quadro k",https://www.marktplaats.nl/v/computers-en-software/desktop-pc-s/a1497307768-hp-z440-workstation-xeon-16gb-ram-256gb-ssd,Gisteren,Gebruikt
HP - Scanner Controller Board M775 (CC522-67931),"€ 195,00",Scanner controller board m775 (cc522-67931) tcop bv(second hand hp) weerschip 10 3991 cr houten tel.: 030-2288022 Fax.: 030-225084,https://www.marktplaats.nl/v/computers-en-software/printerbenodigdheden/a1497304143-hp-scanner-controller-board-m775-cc522-67931,Gisteren,Zo goed als nieuw
HP - 5-baks sorteersysteem voor 500 vel (cb520a),"€ 195,00",5-baks sorteersysteem voor 500 vel (cb520a) tcop bv(second hand hp) weerschip 10 3991 cr houten tel.: 030-2288022 Fax.: 030-225084,https://www.marktplaats.nl/v/computers-en-software/printerbenodigdheden/a1497304236-hp-5-baks-sorteersysteem-voor-500-vel-cb520a,18 jan 25,Zo goed als nieuw
HP - bulk tray for 4250/4350 (q2444b),"€ 100,00",Bulk tray for 4250/4350 (q2444b) tcop bv(second hand hp) weerschip 10 3991 cr houten tel.: 030-2288022 Fax.: 030-2250842 Bezichtig,https://www.marktplaats.nl/v/computers-en-software/printerbenodigdheden/a1497304202-hp-bulk-tray-for-4250-4350-q2444b,18 jan 25,Zo goed als nieuw
HP Spectre x360 16 (aa0660nd),"€ 1.250,00","I.v.m. Andere wensen en te weinig gebruik te koop een werkelijk zo goed als nieuwe hp envy. Inclusief. Lader, hp pen, tas en muis.",https://www.marktplaats.nl/v/computers-en-software/windows-laptops/m2222707565-hp-spectre-x360-16-aa0660nd,Vandaag,Zo goed als nieuw
Lenovo Tiny M720q i5 8GB DDR4 256GB NVMe Windows 11/10,"€ 279,00",Welkom bij pc magnaat! Graag bieden wij u het volgende aan: merk : lenovo model: thinkcentre m720q formaat: klein (tiny) processor,https://www.marktplaats.nl/v/computers-en-software/desktop-pc-s/a1509614869-lenovo-tiny-m720q-i5-8gb-ddr4-256gb-nvme-windows-11-10,Vandaag,Zo goed als nieuw
HP - cp5525-m775 3x500-sheet feeder and stand (cf242a),"€ 250,00",Cp5525-m775 3x500-sheet feeder and stand (cf242a) tcop bv(second hand hp) weerschip 10 3991 cr houten tel.: 030-2288022 Fax.: 030-,https://www.marktplaats.nl/v/computers-en-software/printerbenodigdheden/a1497304348-hp-cp5525-m775-3x500-sheet-feeder-and-stand-cf242a,Eergisteren,Zo goed als nieuw
HP ultra slim docking station 2013,"€ 15,00","Hp 2013 ultraslim docking station creëer snel en gemakkelijk een gebruiksklare werkplek met meer scherm-, netwerk- en apparaataans",https://www.marktplaats.nl/v/computers-en-software/dockingstations/m2226336037-hp-ultra-slim-docking-station-2013,Vandaag,Gebruikt
HP - PageWide Enterprise papierlade voor 3x500 vel en,"€ 295,00","- nog op voorraad:21 hp printerkast: pagewide enterprise papierlade voor 3x500 vel en standaard - zwart, grijs kenmerken pagewide",https://www.marktplaats.nl/v/computers-en-software/printerbenodigdheden/a1497304284-hp-pagewide-enterprise-papierlade-voor-3x500-vel-en,Vandaag,Nieuw
HP - 500-sheet 5-bin Mailbox for M60X series (F2G81A),"€ 250,00",500-sheet 5-bin mailbox for m60x series (f2g81a) tcop bv(second hand hp) weerschip 10 3991 cr houten tel.: 030-2288022 Fax.: 030-2,https://www.marktplaats.nl/v/computers-en-software/printerbenodigdheden/a1497304172-hp-500-sheet-5-bin-mailbox-for-m60x-series-f2g81a,18 jan 25,Zo goed als nieuw
HP - onderstel met kastje (p0v03a),"€ 295,00",Onderstel met kastje (p0v03a) tcop bv(second hand hp) weerschip 10 3991 cr houten tel.: 030-2288022 Fax.: 030-2250842 Bezichtiging,https://www.marktplaats.nl/v/computers-en-software/printerbenodigdheden/a1497304254-hp-onderstel-met-kastje-p0v03a,18 jan 25,Zo goed als nieuw
HP - 500 SHEET INPUT TRAY (Q7817A),"€ 35,00",500 sheet input tray (q7817a) tcop bv(second hand hp) weerschip 10 3991 cr houten tel.: 030-2288022 Fax.: 030-2250842 Bezichtiging,https://www.marktplaats.nl/v/computers-en-software/printerbenodigdheden/a1497304158-hp-500-sheet-input-tray-q7817a,19 jan 25,Zo goed als nieuw
HP - HP LaserJet Pro 550-sheet Feeder Tray (D9P29A) voor,"€ 50,00",- nog op voorraad:63 hp laserjet pro 550-sheet feeder tray (d9p29a) voor m402 serie tcop bv(second hand hp) weerschip 10 3991 cr h,https://www.marktplaats.nl/v/computers-en-software/printerbenodigdheden/a1497304291-hp-hp-laserjet-pro-550-sheet-feeder-tray-d9p29a-voor,18 jan 25,Nieuw
Hp Elitebook 860 G10 Intel Core Ultra 5 16 Inch 512 GB SSD,"€ 999,00","In nieuwstaat zonder doos, met nieuwe lader. Volledig werkend inclusief fabrieksgarantie. Afkomstig van groot bedrijf, mag weg weg",https://www.marktplaats.nl/v/computers-en-software/windows-laptops/m2223357063-hp-elitebook-860-g10-intel-core-ultra-5-16-inch-512-gb-ssd,Vandaag,Zo goed als nieuw
HP - pagewide 4k sheet hc paper tray/stand (w1b52a),"€ 895,00",Pagewide 4k sheet hc paper tray/stand (w1b52a) tcop bv(second hand hp) weerschip 10 3991 cr houten tel.: 030-2288022 Fax.: 030-225,https://www.marktplaats.nl/v/computers-en-software/printerbenodigdheden/a1504389598-hp-pagewide-4k-sheet-hc-paper-tray-stand-w1b52a,Vandaag,Zo goed als nieuw
HP EliteDisplay E222 Monitor 21.5 inch,"€ 30,00",Hp elitedisplay e222 monitor 21.5 Inch full hd ips. Stroom en displayport kabels zitten er bij. Resolutie: 1920x1080 (full hd) ref,https://www.marktplaats.nl/v/computers-en-software/monitoren/m2225367389-hp-elitedisplay-e222-monitor-21-5-inch,19 jan 25,Zo goed als nieuw
"HP - internal usb ports for m506a, m527 (f2a87a)","€ 25,00","Internal usb ports for m506a, m527 (f2a87a) tcop bv(second hand hp) weerschip 10 3991 cr houten tel.: 030-2288022 Fax.: 030-225084",https://www.marktplaats.nl/v/computers-en-software/printerbenodigdheden/a1497304217-hp-internal-usb-ports-for-m506a-m527-f2a87a,19 jan 25,Zo goed als nieuw
HP - pagewide enterprise papierlade voor 3x500 vel en,"€ 295,00",Pagewide enterprise papierlade voor 3x500 vel en standaard (g1w45 tcop bv(second hand hp) weerschip 10 3991 cr houten tel.: 030-22,https://www.marktplaats.nl/v/computers-en-software/printerbenodigdheden/a1504389595-hp-pagewide-enterprise-papierlade-voor-3x500-vel-en,Vandaag,Zo goed als nieuw
"HP - Clj 550-sheet media tray M552,M553,M577, E57540","€ 79,00",- nog op voorraad:29 hp laserjet papierinvoer/lade voor 500 vel (ce530a) voor p3015 serie tcop bv(second hand hp) weerschip 10 399,https://www.marktplaats.nl/v/computers-en-software/printerbenodigdheden/a1507695692-hp-clj-550-sheet-media-tray-m552-m553-m577-e57540,Vandaag,Nieuw
HP Zbook 15 G5 Intel Core i7 8850H | 16GB | 512GB | Nvidi...,"€ 469,00","Nu in de aanbieding van € 499,00 voor € 469,00! L&o computers maakt de verkoop van gebruikte ex-lease producten moge",https://www.marktplaats.nl/v/computers-en-software/windows-laptops/a1508549179-hp-zbook-15-g5-intel-core-i7-8850h-16gb-512gb-nvidi,Eergisteren,Zo goed als nieuw
HP - Netwerkkaart 620N (J7934G),"€ 50,00",7934-69011=j7934a=j7934g hp jetdirect 620n internal print server - 10baset and 100basetx lan interface board - plugs into peripher,https://www.marktplaats.nl/v/computers-en-software/printerbenodigdheden/a1497304170-hp-netwerkkaart-620n-j7934g,Eergisteren,Zo goed als nieuw
Dell Optiplex 3060 MFF i3-8100T 8GB 128GB NVMe windows 10/11,"€ 129,00",Welkom bij pc magnaat! Graag bieden wij u het volgende aan: merk : dell model serie: optiplex model type: 3060 formaat: klein (tin,https://www.marktplaats.nl/v/computers-en-software/desktop-pc-s/a1509614849-dell-optiplex-3060-mff-i3-8100t-8gb-128gb-nvme-windows-10-11,Eergisteren,Zo goed als nieuw
HP ZBook 15 G3 | Core i7 / 32GB / 1TB SSD,"€ 449,00","Hp workstation zbook 15 g3 extreem sterke laptop, een echte desktopvervanger. Wordt geleverd met adapter en netsnoer. Voorzien van",https://www.marktplaats.nl/v/computers-en-software/windows-laptops/a1498036870-hp-zbook-15-g3-core-i7-32gb-1tb-ssd,Eergisteren,Gebruikt
HP ProBook 650 G2 - Azerty | Intel Core i5 | 8GB,"€ 165,00","Ontdek de hp probook 650 g2, een betrouwbare laptop met een 15,6"" full hd beeldscherm, ideaal voor zowel werk als entertainme",https://www.marktplaats.nl/v/computers-en-software/windows-laptops/a1508150204-hp-probook-650-g2-azerty-intel-core-i5-8gb,Eergisteren,Zo goed als nieuw
HP - inkjet 250-sheet paper tray (c8261a),"€ 50,00",Inkjet 250-sheet paper tray (c8261a) tcop bv(second hand hp) weerschip 10 3991 cr houten tel.: 030-2288022 Fax.: 030-2250842 Bezic,https://www.marktplaats.nl/v/computers-en-software/printerbenodigdheden/a1497304249-hp-inkjet-250-sheet-paper-tray-c8261a,Eergisteren,Zo goed als nieuw
HP - pagewide papierlade voor 3x500 vel en standaard (g1w45),"€ 295,00",Pagewide papierlade voor 3x500 vel en standaard (g1w45) tcop bv(second hand hp) weerschip 10 3991 cr houten tel.: 030-2288022 Fax.,https://www.marktplaats.nl/v/computers-en-software/printerbenodigdheden/a1504389594-hp-pagewide-papierlade-voor-3x500-vel-en-standaard-g1w45,Eergisteren,Zo goed als nieuw
HP Scanjet 3970,Bieden,Hp scanjet 3970 leuke flatbadscanner. Merk: hp type: 3970 aansluiting: usb 2.0 Resolutie: 2400dpi afmeting: 65x298x477mm (hxbxd) c,https://www.marktplaats.nl/v/computers-en-software/scanners/m2226121699-hp-scanjet-3970,Gisteren,Gebruikt
HP - m4555 3x500-sheet paper feeder with stand (ce735a),"€ 195,00",M4555 3x500-sheet paper feeder with stand (ce735a) tcop bv(second hand hp) weerschip 10 3991 cr houten tel.: 030-2288022 Fax.: 030,https://www.marktplaats.nl/v/computers-en-software/printerbenodigdheden/a1497304347-hp-m4555-3x500-sheet-paper-feeder-with-stand-ce735a,Gisteren,Zo goed als nieuw
"HP - kit-inner finisher hole 2/4 e725, e778, e825, e876","€ 995,00","Kit-inner finisher hole 2/4 e725, e778, e825, e876 (y1g03a) tcop bv(second hand hp) weerschip 10 3991 cr houten tel.: 030-2288022",https://www.marktplaats.nl/v/computers-en-software/printerbenodigdheden/a1497304230-hp-kit-inner-finisher-hole-2-4-e725-e778-e825-e876,15 jan 25,Nieuw
"HP - Clj 550-sheet media tray M552,M553,M577, E57540","€ 79,00",- nog op voorraad:29 hp laserjet papierinvoer/lade voor 500 vel (ce530a) voor p3015 serie tcop bv(second hand hp) weerschip 10 399,https://www.marktplaats.nl/v/computers-en-software/printerbenodigdheden/a1507695692-hp-clj-550-sheet-media-tray-m552-m553-m577-e57540,19 jan 25,Nieuw
HP - HP Color LaserJet papierlade voor 500 vel (CE860A) for,"€ 95,00",- nog op voorraad:1 hp color laserjet papierlade voor 500 vel (ce860a) for cp5225/5525/m750/m775 tcop bv(second hand hp) weerschip,https://www.marktplaats.nl/v/computers-en-software/printerbenodigdheden/a1497304155-hp-hp-color-laserjet-papierlade-voor-500-vel-ce860a-for,Vandaag,Nieuw
"HP Elitebook 745g3 Amd1,8ghz 4 cores, 8gb mem, 256ssd, 15,6","€ 149,00","Greyhouse heeft op voorraad: processor: amd pro a10-8700b r6, 1,8ghz 4cores ssd harddisk: nieuwe 256gb. Werkgeheugen: 8gb. Beeldsc",https://www.marktplaats.nl/v/computers-en-software/windows-laptops/a1508611904-hp-elitebook-745g3-amd1-8ghz-4-cores-8gb-mem-256ssd-15-6,Vandaag,Gebruikt
