Title,Price,Description,Link,Date,Usage
Figuur - Swarovski - Kinderwagen (Boxed + Certificate) -,"€ 10,00","Bekijk de foto's voor een duidelijke indruk, de staat en de inhoud. Wordt netjes verpakt en aangetekend verzonden. Zie ook onz",https://www.marktplaats.nl/v/antiek-en-kunst/curiosa-en-brocante/a1509843626-figuur-swarovski-kinderwagen-boxed-certificate,Gisteren,No usage
Figuur - Swarovski - Kinderwagen (Boxed + Certificate) -,"€ 14,00","Bekijk de foto's voor een duidelijke indruk, de staat en de inhoud. Wordt netjes verpakt en aangetekend verzonden. Zie ook onz",https://www.marktplaats.nl/v/antiek-en-kunst/curiosa-en-brocante/a1509635651-figuur-swarovski-kinderwagen-boxed-certificate,Gisteren,No usage
Figuur - Decoratieve Buggy met menner (antiek model) -,"€ 3,00",Dit gedetailleerd afgewerkte antieke model van paard en menner is een fraai kunstvoorwerp van zeer stevig metaal en polyresin. Het,https://www.marktplaats.nl/v/antiek-en-kunst/kunst-designobjecten/a1509794454-figuur-decoratieve-buggy-met-menner-antiek-model,Gisteren,No usage
Antieke poppenwagen/kinderwagen,Bieden,In nette en mooie staat. 70 Cm lang/42 cm breed en 63 cm hoog ( vanaf handgreep) 42 cm hoog ( zonder handgreep) vlechtwerk is van,https://www.marktplaats.nl/v/antiek-en-kunst/antiek-speelgoed/m2224356967-antieke-poppenwagen-kinderwagen,Vandaag,Ophalen
Oude rieten kinderwagen brocante wagen,Zie omschrijving,"Bij antiekboerderij de olde fietse vindt u álles op gebied van antiek, brocante & curiosa en leuke nostalgische-hebbedingetjes",https://www.marktplaats.nl/v/antiek-en-kunst/curiosa-en-brocante/m2224314499-oude-rieten-kinderwagen-brocante-wagen,Vandaag,Verzenden
Figuur - Swarovski - Kinderwagen (Boxed + Certificate) -,"€ 10,00","Bekijk de foto's voor een duidelijke indruk, de staat en de inhoud. Wordt netjes verpakt en aangetekend verzonden. Zie ook onz",https://www.marktplaats.nl/v/antiek-en-kunst/curiosa-en-brocante/a1509843626-figuur-swarovski-kinderwagen-boxed-certificate,11 jan 25,No usage
Poppen kinderwagen. Grote.,"€ 25,00",In goede staat. De kap doet het nog. Hij rijd. De kappen stof is niet kapot. Afmetingen zijn van leuning tot grond is 52 cm. Van l,https://www.marktplaats.nl/v/antiek-en-kunst/antiek-speelgoed/m2224029792-poppen-kinderwagen-grote,Gisteren,Ophalen
Mooie Poppen kinderwagen.,"€ 10,00",Stoffering niet gescheurd. Hij rijd nog. Alles zit goed vast. Kap kan ook nog open en dicht. Afmetingen zin van handvat tot vloer,https://www.marktplaats.nl/v/antiek-en-kunst/antiek-speelgoed/m2224035779-mooie-poppen-kinderwagen,Gisteren,Ophalen
Figuur - Swarovski - Kinderwagen (Boxed + Certificate) -,"€ 14,00","Bekijk de foto's voor een duidelijke indruk, de staat en de inhoud. Wordt netjes verpakt en aangetekend verzonden. Zie ook onz",https://www.marktplaats.nl/v/antiek-en-kunst/curiosa-en-brocante/a1509635651-figuur-swarovski-kinderwagen-boxed-certificate,Gisteren,No usage
Gzhel Rusland * porselein * blauw / wit * zie 23 x foto,Zie omschrijving,Gzhel ussr # rusland - 3 x fraai beeld - porselein in blauw wit - zie alle foto's. Heeft alle jaren in vitrine kast gestaan (,https://www.marktplaats.nl/v/antiek-en-kunst/antiek-porselein/m2224340794-gzhel-rusland-porselein-blauw-wit-zie-23-x-foto,Vandaag,Ophalen of Verzenden
Antieke poppenwagen/kinderwagen,"€ 20,00","Was de bedoeling om hem zelf op te knappen, heeft alleen een beetje verf nodig aan de zijkant, maar heb er de tijd niet voor. Daar",https://www.marktplaats.nl/v/antiek-en-kunst/antiek-speelgoed/m2224357990-antieke-poppenwagen-kinderwagen,Vandaag,Ophalen
Figuur - Decoratieve Buggy met menner (antiek model) -,"€ 3,00",Dit gedetailleerd afgewerkte antieke model van paard en menner is een fraai kunstvoorwerp van zeer stevig metaal en polyresin. Het,https://www.marktplaats.nl/v/antiek-en-kunst/kunst-designobjecten/a1509794454-figuur-decoratieve-buggy-met-menner-antiek-model,10 jan 25,No usage
Kinderwagen Poppenwagen,Bieden,Op te halen in heeg. Merk koelstra. Voor de grote en kleine mama de kinderwagen is in goede staat met nieuwe draagrubbers. Onderst,https://www.marktplaats.nl/v/antiek-en-kunst/curiosa-en-brocante/m2210143954-kinderwagen-poppenwagen,7 dec 24,Ophalen
prachtige antieke kinderwagen,"€ 100,00","Prachtige antieke kinderwagen. Staat hier al vele jaren ter decoratie. Inclusief antieke koffer, dekbed en dekbedovertrekje. De le",https://www.marktplaats.nl/v/antiek-en-kunst/curiosa-en-brocante/m2220552965-prachtige-antieke-kinderwagen,6 jan 25,Ophalen
Antieke kinderwagen € 125,"€ 125,00",Antiek bunschoten 2000m2 antiek woonplezier . Inruil / ruil altijd bespreekbaar. Geopend op vrij - zat - ma van 10 tot 16 uur ant,https://www.marktplaats.nl/v/antiek-en-kunst/antiek-speelgoed/m2213278867-antieke-kinderwagen-125,16 dec 24,Ophalen
vintage kinderwagen unilando,"€ 85,00",Mooie complete kinderwagen mooie koets voor baby of voor de  sier met poppen en beren  compleet nieuw matrasje lakentjes dekentje,https://www.marktplaats.nl/v/antiek-en-kunst/curiosa-en-brocante/m2156692047-vintage-kinderwagen-unilando,24 dec 24,Ophalen
Antieke Kinderwagen,Bieden,Er zijn er 2 in nederland waar dit er 1 van is. Alleen weet ik niet hoe het met die andere kinderwagen gaat. Deze kinderwagen kan,https://www.marktplaats.nl/v/antiek-en-kunst/curiosa-en-brocante/m2214748620-antieke-kinderwagen,20 dec 24,Ophalen
Vintage poppenwagen - kinderwagen speelgoed,Bieden,Mooie vintage speelgoed kinderwagen. Hoogte van handgreep is 78 cm. Ik verkoop deze omdat er niet meer mee gespeeld wordt en dat v,https://www.marktplaats.nl/v/antiek-en-kunst/antiek-speelgoed/m2218952300-vintage-poppenwagen-kinderwagen-speelgoed,6 jan 25,Ophalen
Oude Kinderwagen uit 1960 de Rolls Royce onder de kinderwage,"€ 65,00",Wegens verhuizing te koop. Oude kinderwagen uit 1960 de rolls royce onder de kinderwagens. De vraagprijs is 150 euro 125 euro 95 e,https://www.marktplaats.nl/v/antiek-en-kunst/antiek-speelgoed/m2218681584-oude-kinderwagen-uit-1960-de-rolls-royce-onder-de-kinderwage,2 jan 25,Ophalen
Twee decoratieve kinderwagens of poppenwagens,"€ 75,00",De grote pop in het midden is niet meer te koop. De kleine kinderwagen is met een pop met een knuffelbeer. Deze antieke kinderwage,https://www.marktplaats.nl/v/antiek-en-kunst/antiek-speelgoed/m2214129036-twee-decoratieve-kinderwagens-of-poppenwagens,18 dec 24,Ophalen of Verzenden
Kinderwagen jaren 50/60,Bieden,Een ouderwetse kinderwagen voor kinderen zware wielen met rubberen banden wel schoonmaak beurt nodig rijd nog prima ruim 60 cm bre,https://www.marktplaats.nl/v/antiek-en-kunst/curiosa-en-brocante/m2174660181-kinderwagen-jaren-50-60,9 okt 24,Ophalen
Antieke poppenwagen kinderwagen met porseleinen pop,Bieden,Antieke houten poppenwagen met ijzeren wielen en houten mand etc. Kinderwagen is inclusief de porseleinen pop. De kap kan omlaag m,https://www.marktplaats.nl/v/antiek-en-kunst/antiek-speelgoed/m2217855398-antieke-poppenwagen-kinderwagen-met-porseleinen-pop,30 dec 24,Ophalen of Verzenden
origineel houten kinderwagen uit 1930,Bieden,Deze antieke kinderwagen had oorspronkelijk houten wielen. De vervangende rubberen zijn ver vergaan. Zowel de rugleuning als de vo,https://www.marktplaats.nl/v/antiek-en-kunst/antiek-speelgoed/m2200675724-origineel-houten-kinderwagen-uit-1930,12 nov 24,Ophalen
Diverse Antiek Te koop ! Zie alle foto’s alles in Topstaat,Zie omschrijving,"Diverse antiek te koop !  Spinnenkop tafel  biedenmeyer met fruit op de poten 100, euro 2x sets van 4 stoelen in topstaat ! Per se",https://www.marktplaats.nl/v/antiek-en-kunst/antiek-meubels-tafels/m2223951674-diverse-antiek-te-koop-zie-alle-foto-s-alles-in-topstaat,Gisteren,Ophalen of Verzenden
Antiek Heubach popje met gesloten mond miniatuur kinderwagen,Bieden,"Antiek heubach popje met een gesloten mond. Volledig gemaakt van porselein. Geen haarlijnen, in onbespeelde staat. Hij draagt zijn",https://www.marktplaats.nl/v/antiek-en-kunst/antiek-speelgoed/m2217329793-antiek-heubach-popje-met-gesloten-mond-miniatuur-kinderwagen,29 dec 24,Ophalen of Verzenden
